posicion,empresa,ubicacion,num_conv,n_vac,salario,fecha_inicio,fecha_fin,id_uuid,fechaActualizacion
COORDINADOR DE INNOVACION DE SOPORTE TECNOLOGICO,UNIDAD DE GESTION EDUCATIVA LOCAL DE YUNGUYO,PUNO - COPANI,D.LEG 1057 - DETERMINADO (NECESIDAD TRANSITORIA)-06,1,"S/. 1,614.19",04/03/2025,17/03/2025,c66a397f-2ef8-41ee-886a-051b82b3042d,2025-03-05 02:34:14.367958
PERSONAL DE MANTENIMIENTO,UNIDAD DE GESTION EDUCATIVA LOCAL DE YUNGUYO,PUNO - COPANI,D.LEG 1057 - DETERMINADO (NECESIDAD TRANSITORIA)-04,1,"S/. 1,414.19",04/03/2025,17/03/2025,2de96834-9342-4273-ae55-92fb3481a728,2025-03-05 02:34:14.367958
PSICÓLOGO,UNIDAD DE GESTION EDUCATIVA LOCAL DE YUNGUYO,PUNO - COPANI,D.LEG 1057 - DETERMINADO (NECESIDAD TRANSITORIA)-01,1,"S/. 2,764.19",04/03/2025,17/03/2025,2d73f7bc-ac7c-402c-b2b6-49e3cd61a3f7,2025-03-05 02:34:14.367958
COORDINADOR DE INNOVACION DE SOPORTE TECNOLOGICO,UNIDAD DE GESTION EDUCATIVA LOCAL DE YUNGUYO,PUNO - YUNGUYO,D.LEG 1057 - DETERMINADO (NECESIDAD TRANSITORIA)-06,1,"S/. 1,614.19",04/03/2025,17/03/2025,935f54f9-1b42-4b28-bc57-a1803025c5f1,2025-03-05 02:34:14.367958
ESPECIALISTA DE CONVIVENCIA ESCOLAR DE LA UGEL,UNIDAD DE GESTION EDUCATIVA LOCAL DE YUNGUYO,PUNO - YUNGUYO,D.LEG 1057 - DETERMINADO (NECESIDAD TRANSITORIA)-03,1,"S/. 3,764.19",04/03/2025,17/03/2025,12dfbd2a-334c-4867-b95a-56aebcb1876c,2025-03-05 02:34:14.367958
OORDINADOR DE INNOVACION DE SOPORTE TECNOLOGICO,UNIDAD DE GESTION EDUCATIVA LOCAL DE YUNGUYO,PUNO - YUNGUYO,D.LEG 1057 - DETERMINADO (NECESIDAD TRANSITORIA)-06,1,"S/. 1,614.19",04/03/2025,17/03/2025,aa072ad3-5327-410c-b833-5b94d524f73f,2025-03-05 02:34:14.367958
OORDINADOR DE INNOVACION DE SOPORTE TECNOLOGICO,UNIDAD DE GESTION EDUCATIVA LOCAL DE YUNGUYO,PUNO - YUNGUYO,D.LEG 1057 - DETERMINADO (NECESIDAD TRANSITORIA)-06,1,"S/. 1,614.19",04/03/2025,17/03/2025,f976850b-63b5-4081-a15c-3e73179241ab,2025-03-05 02:34:14.367958
PERSONAL  DE VIGILANTE,UNIDAD DE GESTION EDUCATIVA LOCAL DE YUNGUYO,PUNO - YUNGUYO,D.LEG 1057 - DETERMINADO (NECESIDAD TRANSITORIA)-07,1,"S/. 1,417.19",04/03/2025,17/03/2025,e563869e-a7d9-4420-8446-ef53ff988420,2025-03-05 02:34:14.367958
PERSONAL DE MANTENIMIENTO,UNIDAD DE GESTION EDUCATIVA LOCAL DE YUNGUYO,PUNO - YUNGUYO,D.LEG 1057 - DETERMINADO (NECESIDAD TRANSITORIA)-04,1,"S/. 1,414.19",04/03/2025,17/03/2025,178b7e64-872e-47d2-b329-00a56059331b,2025-03-05 02:34:14.367958
PERSONAL DE MANTENIMIENTO,UNIDAD DE GESTION EDUCATIVA LOCAL DE YUNGUYO,PUNO - YUNGUYO,D.LEG 1057 - DETERMINADO (NECESIDAD TRANSITORIA)-04,1,"S/. 1,414.19",04/03/2025,17/03/2025,9811380e-5535-4883-bd53-4dec953d5f26,2025-03-05 02:34:14.367958
PROFESIONAL III PARA EQUIPO ITINERANTE DE CONVIVENCIA ESCOLAR,UNIDAD DE GESTION EDUCATIVA LOCAL DE YUNGUYO,PUNO - YUNGUYO,D.LEG 1057 - DETERMINADO (NECESIDAD TRANSITORIA)-02,1,"S/. 3,064.19",04/03/2025,17/03/2025,252e42ba-2b5d-4c95-b3d7-c2e12bc89bd8,2025-03-05 02:34:14.367958
PSICÓLOGO,UNIDAD DE GESTION EDUCATIVA LOCAL DE YUNGUYO,PUNO - YUNGUYO,D.LEG 1057 - DETERMINADO (NECESIDAD TRANSITORIA)-1,1,"S/. 2,764.19",04/03/2025,17/03/2025,4d6f8f2a-b58e-4754-be2f-d7496a29883a,2025-03-05 02:34:14.367958
PSICÓLOGO,UNIDAD DE GESTION EDUCATIVA LOCAL DE YUNGUYO,PUNO - YUNGUYO,D.LEG 1057 - DETERMINADO (NECESIDAD TRANSITORIA)-01,1,"S/. 2,764.19",04/03/2025,17/03/2025,ba11fda3-a1f0-47d8-b0a6-45fcedb3de1e,2025-03-05 02:34:14.367958
PSICÓLOGO,UNIDAD DE GESTION EDUCATIVA LOCAL DE YUNGUYO,PUNO - YUNGUYO,D.LEG 1057 - DETERMINADO (NECESIDAD TRANSITORIA)-04,1,"S/. 2,764.19",04/03/2025,17/03/2025,41ec3b08-6d4e-49f6-872d-661ea7f60cb6,2025-03-05 02:34:14.367958
COORDINADOR DE INNOVACION DE SOPORTE TECNOLOGICO,UNIDAD DE GESTION EDUCATIVA LOCAL DE YUNGUYO,PUNO - OLLARAYA,D.LEG 1057 - DETERMINADO (NECESIDAD TRANSITORIA)-06,1,"S/. 1,614.19",04/03/2025,17/03/2025,6b9d0542-ed10-49ba-bf0d-b8e31e87e9ed,2025-03-05 02:34:14.367958
"ESPECIALISTA EN TURISMO, ARTESANIAS, Y PROMOCION EMPRESARIAL",MUNICIPALIDAD PROVINCIAL DE LAMPA,PUNO - LAMPA,D.LEG 1057 - DETERMINADO (NECESIDAD TRANSITORIA)-1,1,"S/. 2,150.00",03/03/2025,14/03/2025,7ff2c1b8-0422-4ac9-b771-e181c28befde,2025-03-05 02:34:14.367958
ESPECIALISTA LEGAL - PARA LA UNIDAD DE RECURSOS HUMANOS,MUNICIPALIDAD PROVINCIAL DE LAMPA,PUNO - LAMPA,D.LEG 1057 - DETERMINADO (NECESIDAD TRANSITORIA)-1,1,"S/. 1,850.00",03/03/2025,14/03/2025,e3dc473d-b7c1-426e-8c2a-b47dcca99400,2025-03-05 02:34:14.367958
ESPECIALISTA LEGAL DE LA ADMINISTRACION DEL TERMINAL TERRESTRE,MUNICIPALIDAD PROVINCIAL DE LAMPA,PUNO - LAMPA,D.LEG 1057 - DETERMINADO (NECESIDAD TRANSITORIA)-1,1,"S/. 1,850.00",03/03/2025,14/03/2025,7c5aea57-5698-4d8d-89b2-bc21a9ed0665,2025-03-05 02:34:14.367958
ESPECIALISTA LEGAL DE LA OFICINA DE TRANSPORTES,MUNICIPALIDAD PROVINCIAL DE LAMPA,PUNO - LAMPA,D.LEG 1057 - DETERMINADO (NECESIDAD TRANSITORIA)-1,1,"S/. 1,800.00",03/03/2025,14/03/2025,6fdffa8f-d21b-4bac-bab1-c7d3ef2ddc0f,2025-03-05 02:34:14.367958
ESPECIALISTA LEGAL DE SECRETARIA GENERAL,MUNICIPALIDAD PROVINCIAL DE LAMPA,PUNO - LAMPA,D.LEG 1057 - DETERMINADO (NECESIDAD TRANSITORIA)-1,1,"S/. 1,850.00",03/03/2025,14/03/2025,c1b5f2e8-af49-4934-b1d1-90542b8b9a21,2025-03-05 02:34:14.367958
ESPECIALISTA LEGAL I,MUNICIPALIDAD PROVINCIAL DE LAMPA,PUNO - LAMPA,D.LEG 1057 - DETERMINADO (NECESIDAD TRANSITORIA)-1,1,"S/. 1,850.00",03/03/2025,14/03/2025,da1f9f06-9980-446f-87c5-ee235ed7955a,2025-03-05 02:34:14.367958
ESPECIALISTA LEGAL II,MUNICIPALIDAD PROVINCIAL DE LAMPA,PUNO - LAMPA,D.LEG 1057 - DETERMINADO (NECESIDAD TRANSITORIA)-01,1,"S/. 1,850.00",03/03/2025,14/03/2025,a07eed2c-3fae-4989-92a7-3c0c154b36b4,2025-03-05 02:34:14.367958
ESPECIALISTA LEGAL PARA LA DIVISION DE CATASTRO Y HABILITACIONES URBANAS,MUNICIPALIDAD PROVINCIAL DE LAMPA,PUNO - LAMPA,D.LEG 1057 - DETERMINADO (NECESIDAD TRANSITORIA)-1,1,"S/. 2,000.00",03/03/2025,14/03/2025,9e34b906-d6bf-4691-b0ef-609471b917c7,2025-03-05 02:34:14.367958
ESPECIALISTA TECNICO-ADMINISTRATIVO DE INFRAESTRUCTURA,MUNICIPALIDAD PROVINCIAL DE LAMPA,PUNO - LAMPA,D.LEG 1057 - DETERMINADO (NECESIDAD TRANSITORIA)-1,1,"S/. 2,000.00",03/03/2025,14/03/2025,af42277b-3808-4ea7-9146-2c99bdef31fb,2025-03-05 02:34:14.367958
FISCALIZADOR TRIBUTARIO,MUNICIPALIDAD PROVINCIAL DE LAMPA,PUNO - LAMPA,D.LEG 1057 - DETERMINADO (NECESIDAD TRANSITORIA)-1,1,"S/. 1,400.00",03/03/2025,14/03/2025,a9f9be91-5eb5-4032-a5c5-63aa1cd59b52,2025-03-05 02:34:14.367958
INSPECTOR DE TRANSPORTE,MUNICIPALIDAD PROVINCIAL DE LAMPA,PUNO - LAMPA,D.LEG 1057 - DETERMINADO (NECESIDAD TRANSITORIA)-1,1,"S/. 1,350.00",03/03/2025,14/03/2025,c10d79b3-60f7-4279-b7b5-f11ade2b9838,2025-03-05 02:34:14.367958
JEFE DE DEFENSA CIVIL,MUNICIPALIDAD PROVINCIAL DE LAMPA,PUNO - LAMPA,D.LEG 1057 - DETERMINADO (NECESIDAD TRANSITORIA)-1,1,"S/. 2,350.00",03/03/2025,14/03/2025,ebeb9f19-f0e4-4582-ac15-1edd1c633f92,2025-03-05 02:34:14.367958
JEFE DE LA DIVISION DE CATASTRO Y HABILITACIONES URBANAS,MUNICIPALIDAD PROVINCIAL DE LAMPA,PUNO - LAMPA,D.LEG 1057 - DETERMINADO (NECESIDAD TRANSITORIA)-1,1,"S/. 2,150.00",03/03/2025,14/03/2025,38df26d5-fcac-412d-8477-ab6d4e2ac7ef,2025-03-05 02:34:14.367958
JEFE DE LA DIVISION DE ESTUDIOS Y PROYECTOS - UNIDAD FORMULADORA,MUNICIPALIDAD PROVINCIAL DE LAMPA,PUNO - LAMPA,D.LEG 1057 - DETERMINADO (NECESIDAD TRANSITORIA)-1,1,"S/. 2,350.00",03/03/2025,14/03/2025,5ebc2378-ba1d-4829-a5bf-defd3aa12ff1,2025-03-05 02:34:14.367958
JEFE DE LA OFICINA DE CONTABILIDAD,MUNICIPALIDAD PROVINCIAL DE LAMPA,PUNO - LAMPA,D.LEG 1057 - DETERMINADO (NECESIDAD TRANSITORIA)-1,1,"S/. 2,350.00",03/03/2025,14/03/2025,5fca8c8a-269c-4a27-bb7c-580477fe8670,2025-03-05 02:34:14.367958
JEFE DE LA SUB GERENCIA DE DESARROLLO SOCIAL Y SERVICIOS PUBLICOS,MUNICIPALIDAD PROVINCIAL DE LAMPA,PUNO - LAMPA,D.LEG 1057 - DETERMINADO (NECESIDAD TRANSITORIA)-1,1,"S/. 2,350.00",03/03/2025,14/03/2025,610e9395-8d78-421a-a3c9-17d8acc632a6,2025-03-05 02:34:14.367958
JEFE DE LA UNIDAD DE ALMACEN CENTRAL,MUNICIPALIDAD PROVINCIAL DE LAMPA,PUNO - LAMPA,D.LEG 1057 - DETERMINADO (NECESIDAD TRANSITORIA)-1,1,"S/. 2,350.00",03/03/2025,14/03/2025,ed1572bf-d4ac-4633-9321-553912fa545a,2025-03-05 02:34:14.367958
JEFE DE OPERACIONES DE IVP,MUNICIPALIDAD PROVINCIAL DE LAMPA,PUNO - LAMPA,D.LEG 1057 - DETERMINADO (NECESIDAD TRANSITORIA)-1,1,"S/. 2,150.00",03/03/2025,14/03/2025,ecc4c804-a120-4249-9c41-58f091718d36,2025-03-05 02:34:14.367958
JEFE DE OPERACIONES DEL TERMINAL TERRESTRE,MUNICIPALIDAD PROVINCIAL DE LAMPA,PUNO - LAMPA,D.LEG 1057 - DETERMINADO (NECESIDAD TRANSITORIA)-1,1,"S/. 1,850.00",03/03/2025,14/03/2025,b1f550fb-fce2-4a07-85e3-8bea278fdc00,2025-03-05 02:34:14.367958
OPERADOR EN CAMION COMPACTADOR,MUNICIPALIDAD PROVINCIAL DE LAMPA,PUNO - LAMPA,D.LEG 1057 - DETERMINADO (NECESIDAD TRANSITORIA)-1,1,"S/. 1,550.00",03/03/2025,14/03/2025,529384c3-039f-4f4a-9d5c-14f0b5f3bb5a,2025-03-05 02:34:14.367958
PROGRAMADOR DE MAQUINARIA AGRICOLA,MUNICIPALIDAD PROVINCIAL DE LAMPA,PUNO - LAMPA,D.LEG 1057 - DETERMINADO (NECESIDAD TRANSITORIA)-1,1,"S/. 1,350.00",03/03/2025,14/03/2025,3db9d35b-6da7-4273-8146-02dc78d11ed9,2025-03-05 02:34:14.367958
PSICOLOGO,MUNICIPALIDAD PROVINCIAL DE LAMPA,PUNO - LAMPA,D.LEG 1057 - DETERMINADO (NECESIDAD TRANSITORIA)-1,1,"S/. 1,850.00",03/03/2025,14/03/2025,30ec3272-cad8-40ef-ba4b-a78460c3bfb3,2025-03-05 02:34:14.367958
RESPONSABLE DE CAJA,MUNICIPALIDAD PROVINCIAL DE LAMPA,PUNO - LAMPA,D.LEG 1057 - DETERMINADO (NECESIDAD TRANSITORIA)-1,1,"S/. 1,350.00",03/03/2025,14/03/2025,c3e4495f-9cdc-4608-a7a6-619c6ef36e42,2025-03-05 02:34:14.367958
RESPONSABLE DE DEMUNA,MUNICIPALIDAD PROVINCIAL DE LAMPA,PUNO - LAMPA,D.LEG 1057 - DETERMINADO (NECESIDAD TRANSITORIA)-1,1,"S/. 2,300.00",03/03/2025,14/03/2025,66672fc7-767a-47a1-a642-06371f7e4454,2025-03-05 02:34:14.367958
RESPONSABLE DE LA DIVISION DE EQUIPO MECANICO,MUNICIPALIDAD PROVINCIAL DE LAMPA,PUNO - LAMPA,D.LEG 1057 - DETERMINADO (NECESIDAD TRANSITORIA)-1,1,"S/. 1,900.00",03/03/2025,14/03/2025,7b5eab94-6f38-4392-9e77-cf8bdc82adf6,2025-03-05 02:34:14.367958
RESPONSABLE DE LA DIVISON DE DESARROLLO AGROPECUARIO,MUNICIPALIDAD PROVINCIAL DE LAMPA,PUNO - LAMPA,D.LEG 1057 - DETERMINADO (NECESIDAD TRANSITORIA)-1,1,"S/. 2,150.00",03/03/2025,14/03/2025,be5881b9-36e0-4c42-995e-978041ada313,2025-03-05 02:34:14.367958
RESPONSABLE DE LA UNIDAD DE SOPORTE INFORMATICO,MUNICIPALIDAD PROVINCIAL DE LAMPA,PUNO - LAMPA,D.LEG 1057 - DETERMINADO (NECESIDAD TRANSITORIA)-1,1,"S/. 1,950.00",03/03/2025,14/03/2025,7c2b956c-2f71-4f2c-9f64-ae034f6585a6,2025-03-05 02:34:14.367958
RESPONSABLE DE MESA DE PARTES,MUNICIPALIDAD PROVINCIAL DE LAMPA,PUNO - LAMPA,D.LEG 1057 - DETERMINADO (NECESIDAD TRANSITORIA)-1,1,"S/. 1,350.00",03/03/2025,14/03/2025,5dc60f8d-ac33-40c2-9aa8-e0f3f89c5c4a,2025-03-05 02:34:14.367958
RESPONSABLE DE PARTICIPACION CIUDADANA,MUNICIPALIDAD PROVINCIAL DE LAMPA,PUNO - LAMPA,D.LEG 1057 - DETERMINADO (NECESIDAD TRANSITORIA)-1,1,"S/. 1,700.00",03/03/2025,14/03/2025,998aaba7-f6f6-461f-988b-6a158f236e2e,2025-03-05 02:34:14.367958
RESPONSABLE DEL PROGRAMA DE COMPLEMENTACION ALIMENTARIA,MUNICIPALIDAD PROVINCIAL DE LAMPA,PUNO - LAMPA,D.LEG 1057 - DETERMINADO (NECESIDAD TRANSITORIA)-1,1,"S/. 1,800.00",03/03/2025,14/03/2025,2aba037b-7f01-4472-8dd2-5dadf5d55a9c,2025-03-05 02:34:14.367958
ESPECIALISTA REGIONAL EN HIDROCARBUROS - PASCO,ORGANISMO SUPERVISOR DE LA INVERSION EN ENERGIA Y MINERIA,PASCO - YANACANCHA,D.LEG 1057 - DETERMINADO (NECESIDAD TRANSITORIA)-026,1,"S/. 11,000.00",04/03/2025,17/03/2025,8ed6f395-89a8-4e25-b22b-1e12e6129e57,2025-03-05 02:34:14.367958
OBSTETRA,DIRECCION REGIONAL DE SALUD PASCO,PASCO - YANACANCHA,D.LEG 1057 - DETERMINADO (NECESIDAD TRANSITORIA)-1,2,"S/. 5,500.00",03/03/2025,14/03/2025,17df129e-64d3-479b-8c33-9ab14d6db439,2025-03-05 02:34:14.367958
OBSTETRA,DIRECCION REGIONAL DE SALUD PASCO,PASCO - PAUCARTAMBO,D.LEG 1057 - DETERMINADO (NECESIDAD TRANSITORIA)-1,1,"S/. 5,500.00",03/03/2025,14/03/2025,0a4fe890-6e80-4c3f-a78c-fb5dfecf48ca,2025-03-05 02:34:14.367958
(02) MEDICO CIRUJANO GENERAL,DIRECCION REGIONAL DE SALUD PASCO,PASCO - YANACANCHA,D.LEG 1057 - DETERMINADO (NECESIDAD TRANSITORIA)-1,2,"S/. 7,540.00",03/03/2025,14/03/2025,693d5ad9-dbaa-4aa9-a4f0-c9d1666919be,2025-03-05 02:34:14.367958
TECNOLOGO MEDICO O BIOLOGO,DIRECCION REGIONAL DE SALUD PASCO,PASCO - YANACANCHA,D.LEG 1057 - DETERMINADO (NECESIDAD TRANSITORIA)-01,1,"S/. 5,500.00",03/03/2025,14/03/2025,42f8b3cf-9d6b-4152-a69b-608143083888,2025-03-05 02:34:14.367958
(01) GINECOLOGO O MÉDICO CIRUJANO,DIRECCION REGIONAL DE SALUD PASCO,PASCO - PAUCARTAMBO,D.LEG 1057 - DETERMINADO (NECESIDAD TRANSITORIA)-1,1,"S/. 9,000.00",03/03/2025,14/03/2025,79cc5c9c-ffcf-41c1-b577-3324d66e917c,2025-03-05 02:34:14.367958
ESPECIALISTA LEGAL EN MÓDULO PENAL,PODER JUDICIAL,PASCO - PAUCARTAMBO,D.LEG 1057 - DETERMINADO (NECESIDAD TRANSITORIA)-007,1,"S/. 4,000.00",03/03/2025,14/03/2025,911698af-2027-4ac2-8dab-9d94b2a67fa2,2025-03-05 02:34:14.367958
ANALISTA EN PRODUCCIÓN AGROPECUARIA,INSTITUTO NACIONAL DE INNOVACION AGRARIA,PASCO - CHAUPIMARCA,D.LEG 1057 - DETERMINADO (NECESIDAD TRANSITORIA)-037,1,"S/. 4,650.00",03/03/2025,14/03/2025,d1eddf7d-92a3-41cf-8d3c-5d68da1b2cad,2025-03-05 02:34:14.367958
JEFE DE LA DIVISIÓN DE SEGURIDAD CIUDADANA,MUNICIPALIDAD DISTRITAL DE HUANCABAMBA,PASCO - HUANCABAMBA,D.LEG 1057 - DETERMINADO (NECESIDAD TRANSITORIA)-003,1,"S/. 2,100.00",03/03/2025,14/03/2025,65ebe6bb-2f12-4cba-9400-79e934975f65,2025-03-05 02:34:14.367958
PERSONAL DE VIGILANCIA,UNIDAD EJECUTORA DENOMINADA: EDUCACIÓN PUERTO BERMÚDEZ,PASCO - PUERTO BERMUDEZ,D.LEG 1057 - DETERMINADO (NECESIDAD TRANSITORIA)-002,1,"S/. 1,414.19",03/03/2025,14/03/2025,4dc2fc78-692d-4029-9059-9fb60430ee67,2025-03-05 02:34:14.367958
PSICOLOGO(A),UNIDAD EJECUTORA DENOMINADA: EDUCACIÓN PUERTO BERMÚDEZ,PASCO - PUERTO BERMUDEZ,D.LEG 1057 - DETERMINADO (NECESIDAD TRANSITORIA)-002,2,"S/. 2,764.19",28/02/2025,13/03/2025,84e629ba-2ea5-48c7-979e-08afe9699d23,2025-03-05 02:34:14.367958
PROFESIONAL EN TECNOLOGIA MEDICA CON MENCION EN TERAPIA FISICA PARA LOS PROGRAMAS DE INTERVENCION TEMPRANA,UNIDAD EJECUTORA DENOMINADA: EDUCACIÓN PUERTO BERMÚDEZ,PASCO - PUERTO BERMUDEZ,D.LEG 1057 - DETERMINADO (NECESIDAD TRANSITORIA)-002,2,"S/. 2,964.19",28/02/2025,13/03/2025,02fe9b62-ab53-40d3-a8cd-c94e4db26bf5,2025-03-05 02:34:14.367958
MANTENIMIENTO,UNIDAD EJECUTORA DENOMINADA: EDUCACIÓN PUERTO BERMÚDEZ,PASCO - PUERTO BERMUDEZ,D.LEG 1057 - DETERMINADO (NECESIDAD TRANSITORIA)-002,2,"S/. 1,414.19",28/02/2025,13/03/2025,65dd2b8a-bb00-4020-9c7b-b2c5ab898b21,2025-03-05 02:34:14.367958
LIMPIEZA Y MANTENIMIENTO,UNIDAD EJECUTORA DENOMINADA: EDUCACIÓN PUERTO BERMÚDEZ,PASCO - PUERTO BERMUDEZ,D.LEG 1057 - DETERMINADO (NECESIDAD TRANSITORIA)-002,7,"S/. 1,414.19",28/02/2025,13/03/2025,141cfee0-040e-40a2-8290-181605f08c88,2025-03-05 02:34:14.367958
COORDINADOR DE INNOVACIÓN Y SOPORTE TECNOLÓGICO,UNIDAD EJECUTORA DENOMINADA: EDUCACIÓN PUERTO BERMÚDEZ,PASCO - PUERTO BERMUDEZ,D.LEG 1057 - DETERMINADO (NECESIDAD TRANSITORIA)-002,1,"S/. 1,614.19",28/02/2025,13/03/2025,06738585-294e-46cf-8d90-f50feceee439,2025-03-05 02:34:14.367958
DOCENTE TUTORIAL DE COMUNICACIÓN,UNIDAD EJECUTORA DENOMINADA: EDUCACIÓN PUERTO BERMÚDEZ,PASCO - PUERTO BERMUDEZ,D.LEG 1057 - DETERMINADO (NECESIDAD TRANSITORIA)-002,4,"S/. 2,764.19",28/02/2025,13/03/2025,067d3f85-e497-4131-96f7-44d1770deff6,2025-03-05 02:34:14.367958
DOCENTE TUTORIAL DE CIENCIAS SOCIALES,UNIDAD EJECUTORA DENOMINADA: EDUCACIÓN PUERTO BERMÚDEZ,PASCO - PUERTO BERMUDEZ,D.LEG 1057 - DETERMINADO (NECESIDAD TRANSITORIA)-002,4,"S/. 2,764.19",28/02/2025,13/03/2025,9e92daf1-f718-4701-b79d-ec3751c0bba3,2025-03-05 02:34:14.367958
DOCENTE TUTORIAL DE CIENCIA Y TECNOLOGÍA,UNIDAD EJECUTORA DENOMINADA: EDUCACIÓN PUERTO BERMÚDEZ,PASCO - PUERTO BERMUDEZ,D.LEG 1057 - DETERMINADO (NECESIDAD TRANSITORIA)-002,4,"S/. 2,764.19",28/02/2025,13/03/2025,c365a5ef-9cd0-4213-9c4b-35f0e4c219dc,2025-03-05 02:34:14.367958
COORDINADOR(A) DE NÚCLEO EDUCATIVO,UNIDAD EJECUTORA DENOMINADA: EDUCACIÓN PUERTO BERMÚDEZ,PASCO - PUERTO BERMUDEZ,D.LEG 1057 - DETERMINADO (NECESIDAD TRANSITORIA)-002,4,"S/. 3,264.19",28/02/2025,13/03/2025,ad56843b-25c5-4035-b3b6-2a345dca0e40,2025-03-05 02:34:14.367958
DOCENTE TUTORIAL DE MATEMÁTICA,UNIDAD EJECUTORA DENOMINADA: EDUCACIÓN PUERTO BERMÚDEZ,PASCO - PUERTO BERMUDEZ,D.LEG 1057 - DETERMINADO (NECESIDAD TRANSITORIA)-002,4,"S/. 2,764.19",28/02/2025,13/03/2025,2ee42d4e-ff12-4aeb-af3a-f778e0d8ee47,2025-03-05 02:34:14.367958
ESPECIALISTA DE CONVIVENCIA ESCOLAR REGIONAL,DIRECC.SUB-REG.DE EDUCACION DE PASCO,PASCO - YANACANCHA,D.LEG 1057 - DETERMINADO (NECESIDAD TRANSITORIA)-2,1,"S/. 4,064.19",27/02/2025,12/03/2025,3cf9ceb2-094b-4342-8867-0c66e41be769,2025-03-05 02:34:14.367958
ESPECIALISTA DE CALIDAD DEL SERVICIO EDUCATIVO SUPERIOR TECNOLÓGICO,DIRECC.SUB-REG.DE EDUCACION DE PASCO,PASCO - YANACANCHA,D.LEG 1057 - DETERMINADO (NECESIDAD TRANSITORIA)-2,1,"S/. 3,164.19",27/02/2025,12/03/2025,f959cdce-162c-49fe-b431-5d8d74b0b07c,2025-03-05 02:34:14.367958
COORDINADOR LOCAL DE  PREVAED – UGEL  OXAPAMPA,DIRECC.SUB-REG.DE EDUCACION DE PASCO,PASCO - OXAPAMPA,D.LEG 1057 - DETERMINADO (NECESIDAD TRANSITORIA)-2,1,"S/. 2,614.19",27/02/2025,12/03/2025,14d63c85-6038-4cff-b52e-b4eac34d2f9f,2025-03-05 02:34:14.367958
PROFESIONAL DOCENTE ESPECIALISTA EN DISCAPACIDAD AUDITIVA PARA EL CENTRO DE RECURSOS DE EDUCACIÓN BÁSICA ESPECIAL - CREBE,DIRECC.SUB-REG.DE EDUCACION DE PASCO,PASCO - YANACANCHA,D.LEG 1057 - DETERMINADO (NECESIDAD TRANSITORIA)-2,1,"S/. 2,864.19",27/02/2025,12/03/2025,bdc9e49c-f180-4ada-af67-745141df13c9,2025-03-05 02:34:14.367958
PROFESIONAL DOCENTE ESPECIALISTA EN DISCAPACIDAD VISUAL Y SORDOCEGUERA PARA EL CENTRO DE RECURSOS DE EDUCACIÓN BÁSICA ESPECIAL – CREBE,DIRECC.SUB-REG.DE EDUCACION DE PASCO,PASCO - YANACANCHA,D.LEG 1057 - DETERMINADO (NECESIDAD TRANSITORIA)-2,1,"S/. 2,864.19",27/02/2025,12/03/2025,4079f7a8-7569-4379-9cc7-5b7e36139e00,2025-03-05 02:34:14.367958
ANALISTA DE CONTROL DE LA OFERTA DE DROGAS DE OFICINA ZONAL,COMIS.NAC.PARA DESAR.Y VIDA SIN DROGAS,PASCO - CONSTITUCION,LEY 30057-002,1,"S/. 5,400.00",26/02/2025,11/03/2025,d006b469-4a37-4b72-9df6-39e6797782b4,2025-03-05 02:34:14.367958
ANALISTA INTERMEDIO EN SANIDAD E INOCUIDAD DE PRODUCTOS PECUARIOS-SEGUNDA CONVOCATORIA,SERVICIO NACIONAL DE SANIDAD AGRARIA,PASCO - YANACANCHA,D.LEG 1057 - DETERMINADO (NECESIDAD TRANSITORIA)-008,1,"S/. 3,464.19",26/02/2025,11/03/2025,06ac2f21-2a41-4a71-8995-7ba096b00ab4,2025-03-05 02:34:14.367958
ESPECIALISTA EDUCATIVO,PROGRAMA NACIONAL DE ALIMENTACIÓN ESCOLAR QALI WARMA,PASCO - YANACANCHA,D.LEG 1057 - DETERMINADO (SUPLENCIA)-016,1,"S/. 3,200.00",21/02/2025,06/03/2025,a145aaad-237f-4181-b315-4b2e425496f2,2025-03-05 02:34:14.367958
MONITOR DE GESTIÓN LOCAL,PROGRAMA NACIONAL DE ALIMENTACIÓN ESCOLAR QALI WARMA,PASCO - VILLA RICA,D.LEG 1057 - DETERMINADO (SUPLENCIA)-017,1,"S/. 2,500.00",21/02/2025,06/03/2025,f1388a14-cdf7-4cc5-a6d6-65fbdb930388,2025-03-05 02:34:14.367958
PROFESIONAL II PARA EQUIPO ITINERANTE DE CONVIVENCIA ESCOLAR,UNIDAD DE GESTION EDUCATIVA OXAPAMPA,PASCO - OXAPAMPA,D.LEG 1057 - DETERMINADO (NECESIDAD TRANSITORIA)-001,1,"S/. 3,064.19",21/02/2025,06/03/2025,6767e983-a36e-4287-9bde-78432349621a,2025-03-05 02:34:14.367958
"ASISTENTE DE LA UNIDAD DE LOGISTICA, BIENES PATRIMONIALES Y PROCESOS",MUNICIPALIDAD DISTRITAL FUNDICION DE TINYAHUARCO,PASCO - TINYAHUARCO,D.LEG 1057 - DETERMINADO (NECESIDAD TRANSITORIA)-001,1,"S/. 1,450.00",21/02/2025,06/03/2025,a670a6a0-0236-4628-9c13-921681fe3188,2025-03-05 02:34:14.367958
ASISTENTE DE REGISTRO CIVIL Y REGISTRADORA CIVIL,MUNICIPALIDAD DISTRITAL FUNDICION DE TINYAHUARCO,PASCO - TINYAHUARCO,D.LEG 1057 - DETERMINADO (NECESIDAD TRANSITORIA)-001,1,"S/. 1,450.00",21/02/2025,06/03/2025,4cb574f9-36d4-4f72-91a3-7b3965e48411,2025-03-05 02:34:14.367958
AYUDANTE DEL CAMION COMPACTADOR,MUNICIPALIDAD DISTRITAL FUNDICION DE TINYAHUARCO,PASCO - TINYAHUARCO,D.LEG 1057 - DETERMINADO (NECESIDAD TRANSITORIA)-001,1,"S/. 1,200.00",21/02/2025,06/03/2025,3b82a584-e383-46cc-80d7-8ef0f6ab8bd1,2025-03-05 02:34:14.367958
CHOFER DEL CAMION COMPACTADOR,MUNICIPALIDAD DISTRITAL FUNDICION DE TINYAHUARCO,PASCO - TINYAHUARCO,D.LEG 1057 - DETERMINADO (NECESIDAD TRANSITORIA)-001,1,"S/. 1,600.00",21/02/2025,06/03/2025,1a5c52ce-bc67-41aa-b397-ec3992134745,2025-03-05 02:34:14.367958
GERENCIA DE DESARROLLO SOCIAL,MUNICIPALIDAD DISTRITAL FUNDICION DE TINYAHUARCO,PASCO - TINYAHUARCO,D.LEG 1057 - DETERMINADO (NECESIDAD TRANSITORIA)-001,1,"S/. 2,100.00",21/02/2025,06/03/2025,6c6cf915-7432-4c06-890a-73689300722e,2025-03-05 02:34:14.367958
GUARDIAN MUNICIPAL,MUNICIPALIDAD DISTRITAL FUNDICION DE TINYAHUARCO,PASCO - TINYAHUARCO,D.LEG 1057 - DETERMINADO (NECESIDAD TRANSITORIA)-001,2,"S/. 1,200.00",21/02/2025,06/03/2025,5d6b7609-0d45-44cb-93f2-569f20564d21,2025-03-05 02:34:14.367958
JEFATURA DE LA UNIDAD DE CONTABILIDAD,MUNICIPALIDAD DISTRITAL FUNDICION DE TINYAHUARCO,PASCO - TINYAHUARCO,D.LEG 1057 - DETERMINADO (NECESIDAD TRANSITORIA)-001,1,"S/. 2,300.00",21/02/2025,06/03/2025,28aa5142-1288-48f3-9d0f-13b65b47eab6,2025-03-05 02:34:14.367958
"JEFATURA DE LA UNIDAD DE LOGISTICA, BIENES PATRIMONIALES Y PROCESOS",MUNICIPALIDAD DISTRITAL FUNDICION DE TINYAHUARCO,PASCO - TINYAHUARCO,D.LEG 1057 - DETERMINADO (NECESIDAD TRANSITORIA)-001,1,"S/. 2,100.00",21/02/2025,06/03/2025,6cf1b188-5d25-4b1e-a437-a78ab1111359,2025-03-05 02:34:14.367958
JEFATURA DE LA UNIDAD DE RECURSOS HUMANOS,MUNICIPALIDAD DISTRITAL FUNDICION DE TINYAHUARCO,PASCO - TINYAHUARCO,D.LEG 1057 - DETERMINADO (NECESIDAD TRANSITORIA)-001,1,"S/. 2,100.00",21/02/2025,06/03/2025,81337ce5-90d4-417c-9763-91caef6c3628,2025-03-05 02:34:14.367958
JEFATURA DE LA UNIDAD DE TESORERIA,MUNICIPALIDAD DISTRITAL FUNDICION DE TINYAHUARCO,PASCO - TINYAHUARCO,D.LEG 1057 - DETERMINADO (NECESIDAD TRANSITORIA)-001,1,"S/. 2,100.00",21/02/2025,06/03/2025,40f0f3f1-ebe6-448d-8a12-31c859e63782,2025-03-05 02:34:14.367958
RELACIONISTA PUBLICO,MUNICIPALIDAD DISTRITAL FUNDICION DE TINYAHUARCO,PASCO - TINYAHUARCO,D.LEG 1057 - DETERMINADO (NECESIDAD TRANSITORIA)-001,1,"S/. 1,450.00",21/02/2025,06/03/2025,e7992d4f-eb14-41ff-82dd-23b69902bc05,2025-03-05 02:34:14.367958
RESPONSABLE DE OMPED Y CIAM,MUNICIPALIDAD DISTRITAL FUNDICION DE TINYAHUARCO,PASCO - TINYAHUARCO,D.LEG 1057 - DETERMINADO (NECESIDAD TRANSITORIA)-001,1,"S/. 1,450.00",21/02/2025,06/03/2025,43b995de-3605-4585-869b-5ba55dbf8954,2025-03-05 02:34:14.367958
SECRETARIA DE ALCALDIA,MUNICIPALIDAD DISTRITAL FUNDICION DE TINYAHUARCO,PASCO - TINYAHUARCO,D.LEG 1057 - DETERMINADO (NECESIDAD TRANSITORIA)-001,1,"S/. 1,450.00",21/02/2025,06/03/2025,8ab8dd4f-2c2f-418a-a44b-857aac77c3af,2025-03-05 02:34:14.367958
TECNICO EN SEGURIDAD DEL RELLENO SANITARIO,MUNICIPALIDAD DISTRITAL FUNDICION DE TINYAHUARCO,PASCO - TINYAHUARCO,D.LEG 1057 - DETERMINADO (NECESIDAD TRANSITORIA)-001,1,"S/. 1,200.00",21/02/2025,06/03/2025,7c75fe60-1c4c-48b3-b55c-ab201d66a54a,2025-03-05 02:34:14.367958
TECNICO OPERADOR DE RELLENO SANITARIO,MUNICIPALIDAD DISTRITAL FUNDICION DE TINYAHUARCO,PASCO - TINYAHUARCO,D.LEG 1057 - DETERMINADO (NECESIDAD TRANSITORIA)-001,4,"S/. 1,200.00",21/02/2025,06/03/2025,edc80b6c-ce7d-4fa5-93f5-f91fbc31ffac,2025-03-05 02:34:14.367958
COORDINADOR TÉCNICO TERRITORIAL,PROGRAMA NACIONAL DE ALIMENTACIÓN ESCOLAR QALI WARMA,PASCO - YANACANCHA,D.LEG 1057 - DETERMINADO (SUPLENCIA)-018,1,"S/. 5,000.00",21/02/2025,06/03/2025,6b270479-c565-4d6c-881d-8acb5181920d,2025-03-05 02:34:14.367958
ESPECIALISTA EN SANIDAD VEGETAL I,SERVICIO NACIONAL DE SANIDAD AGRARIA,PASCO - PAUCARTAMBO,728-5,1,"S/. 3,751.51",20/02/2025,05/03/2025,2725ee8d-a262-4fe6-99d9-6310c4580d9a,2025-03-05 02:34:14.367958
ACOMPAÑANTE TECNICO PARA EL SERVICIO DE CUIDADO DIURNO,PROGRAMA NACIONAL CUNA MAS,PASCO - SAN FRANCISCO DE ASIS DE YARUSYACAN,D.LEG 1057 - DETERMINADO (NECESIDAD TRANSITORIA)-112,1,"S/. 2,764.19",20/02/2025,05/03/2025,ead34d1a-03b3-47c5-8793-80b425090608,2025-03-05 02:34:14.367958
ESPECIALISTA JUDICAL DE SALA,PODER JUDICIAL,PASCO - YANACANCHA,D.LEG 1057 - DETERMINADO (NECESIDAD TRANSITORIA)-006,1,"S/. 3,722.00",20/02/2025,05/03/2025,47231ebf-02a3-4948-ad24-8875a31386af,2025-03-05 02:34:14.367958
REGISTRADOR II,REGISTRO NACIONAL DE IDENTIFICACIÓN Y ESTADO CIVIL,PASCO - CONSTITUCION,D.LEG 1057 - DETERMINADO (NECESIDAD TRANSITORIA)-028,1,"S/. 1,500.00",19/02/2025,04/03/2025,bc67f2c8-2c30-475a-acfe-79acccbffa21,2025-03-05 02:34:14.367958
PSICOTERAPEUTA,MINISTERIO DE LA MUJER Y POBLACIONES VULNERABLES,TUMBES - TUMBES,D.LEG 1057 - DETERMINADO (NECESIDAD TRANSITORIA)-013,1,"S/. 4,000.00",04/03/2025,17/03/2025,2d8a8fe0-248f-45e3-8702-e6e25a6a6631,2025-03-05 02:34:14.367958
PERSONAL DE VIGILANCIA,UNIDAD DE GESTION EDUCATIVA LOCAL DE TUMBES,TUMBES - TUMBES,D.LEG 1057 - DETERMINADO (NECESIDAD TRANSITORIA)-011,1,"S/. 1,414.19",28/02/2025,13/03/2025,91b1ae35-e167-4034-bef8-bed9eed35f8c,2025-03-05 02:34:14.367958
AUXILIAR DE LABORATORIO,UNIDAD DE GESTION EDUCATIVA DE CONTRALMIRANTE VILLAR,TUMBES - ZORRITOS,276-7,1,"S/. 1,210.00",27/02/2025,12/03/2025,d16121ed-4d70-4cc4-9f35-1e0bff9e2393,2025-03-05 02:34:14.367958
INSPECTOR (A) DE MIGRACIONES,SUPERINTENDENCIA NACIONAL DE MIGRACIONES - MIGRACIONES,TUMBES - TUMBES,D.LEG 1057 - DETERMINADO (NECESIDAD TRANSITORIA)-085,1,"S/. 3,000.00",25/02/2025,10/03/2025,983bcab1-f377-4dd6-ba94-887e6096e95a,2025-03-05 02:34:14.367958
ESPECIALISTA EN EQUIPAMIENTO,PROGRAMA NACIONAL CUNA MAS,TUMBES - TUMBES,D.LEG 1057 - DETERMINADO (NECESIDAD TRANSITORIA)-134,1,"S/. 3,664.19",20/02/2025,05/03/2025,7c104d3f-07ef-422f-81ef-dcc9f3a5c5ba,2025-03-05 02:34:14.367958
ASISTENTE OPERATIVO DE VERIFICACIÓN Y FISCALIZACIÓN MIGRATORIA,SUPERINTENDENCIA NACIONAL DE MIGRACIONES - MIGRACIONES,TUMBES - TUMBES,D.LEG 1057 - DETERMINADO (NECESIDAD TRANSITORIA)-069,4,"S/. 3,000.00",19/02/2025,04/03/2025,b5083dd2-a424-4124-a3f6-e6ecd533fe72,2025-03-05 02:34:14.367958
PSICOTERAPEUTA,MINISTERIO DE LA MUJER Y POBLACIONES VULNERABLES,TUMBES - TUMBES,D.LEG 1057 - DETERMINADO (NECESIDAD TRANSITORIA)-013,1,"S/. 4,000.00",04/03/2025,17/03/2025,781d979f-4821-43d2-a5f8-cc54903c0c7d,2025-03-05 02:34:14.367958
