posicion,empresa,ubicacion,num_conv,n_vac,salario,fecha_inicio,fecha_fin,id_uuid,fechaActualizacion
ESPECIALISTA EN PROMOCIÓN SOCIAL,DIRECCION REGIONAL DE YAKU TARPUY PARA LA LUCHA CONTRA LA POBREZA,HUANCAVELICA - HUANCAVELICA,D.LEG 1057 - DETERMINADO (NECESIDAD TRANSITORIA)-1,1,"S/. 3,264.19",03/03/2025,14/03/2025,ce64804a-35b2-41e4-8db8-7614d58dfcc4,2025-03-05 02:34:14.367958
CONTADOR II,GERENCIA SUB REGIONAL TAYACAJA,HUANCAVELICA - PAMPAS,276-002,1,"S/. 2,815.00",03/03/2025,14/03/2025,996040ff-e3e2-4ea8-afaf-b657e546cda9,2025-03-05 02:34:14.367958
TÉCNICO EN ARTES GRÁFICAS II (CODIGO DE AIRHSP – 000453),UNIVERSIDAD NACIONAL DE HUANCAVELICA,HUANCAVELICA - HUANCAVELICA,276-003,1,"S/. 2,689.00",03/03/2025,14/03/2025,ab9825ac-8cf7-49d7-b868-733666bcfdad,2025-03-05 02:34:14.367958
TÉCNICO (CODIGO DE AIRHSP – 000455),UNIVERSIDAD NACIONAL DE HUANCAVELICA,HUANCAVELICA - HUANCAVELICA,276-003,1,"S/. 2,689.00",03/03/2025,14/03/2025,253def46-76bc-4abe-b6fb-62dc0857f39b,2025-03-05 02:34:14.367958
TÉCNICO (CODIGO DE AIRHSP – 000352),UNIVERSIDAD NACIONAL DE HUANCAVELICA,HUANCAVELICA - HUANCAVELICA,276-003,1,"S/. 2,680.00",03/03/2025,14/03/2025,98fb4689-74f8-4494-b3db-af941a2c2676,2025-03-05 02:34:14.367958
OPERADOR DE SERVICIOS GENERALES (CODIGO DE AIRHSP – 000456),UNIVERSIDAD NACIONAL DE HUANCAVELICA,HUANCAVELICA - HUANCAVELICA,276-003,1,"S/. 2,680.00",03/03/2025,14/03/2025,c3a25e26-be4f-4d9f-a29d-478bd9c4a208,2025-03-05 02:34:14.367958
ESPECIALISTA EN RECURSOS HUMANOS I (CODIGO DE AIRHSP – 000356),UNIVERSIDAD NACIONAL DE HUANCAVELICA,HUANCAVELICA - HUANCAVELICA,276-003,1,"S/. 2,833.00",03/03/2025,14/03/2025,67bb39e2-354f-4668-8974-418cdaf3e9b3,2025-03-05 02:34:14.367958
ESPECIALISTA ADMINISTRATIVO I (CODIGO DE AIRHSP – 000377),UNIVERSIDAD NACIONAL DE HUANCAVELICA,HUANCAVELICA - HUANCAVELICA,276-003,1,"S/. 2,833.00",03/03/2025,14/03/2025,28f42b56-6845-408a-8d99-99e67a44a3f7,2025-03-05 02:34:14.367958
ESPECIALISTA (CODIGO DE AIRHSP – 000401),UNIVERSIDAD NACIONAL DE HUANCAVELICA,HUANCAVELICA - HUANCAVELICA,276-003,1,"S/. 2,805.00",03/03/2025,14/03/2025,58074a17-2695-4795-886b-20efad0180f3,2025-03-05 02:34:14.367958
ESPECIALISTA (CODIGO DE AIRHSP – 000357),UNIVERSIDAD NACIONAL DE HUANCAVELICA,HUANCAVELICA - HUANCAVELICA,276-003,1,"S/. 2,833.00",03/03/2025,14/03/2025,7498ddc6-99a5-4c01-ab8d-edfb0c423953,2025-03-05 02:34:14.367958
CHOFER III (CODIGO DE AIRHSP – 000454),UNIVERSIDAD NACIONAL DE HUANCAVELICA,HUANCAVELICA - HUANCAVELICA,276-003,1,"S/. 2,689.00",03/03/2025,14/03/2025,1e81e3ff-42aa-4324-aeb1-c6295a4aeb5d,2025-03-05 02:34:14.367958
ASISTENTE ADMINISTRATIVO II (CODIGO DE AIRHSP – 000349),UNIVERSIDAD NACIONAL DE HUANCAVELICA,HUANCAVELICA - HUANCAVELICA,276-003,1,"S/. 2,805.00",03/03/2025,14/03/2025,99f2159f-77af-4ee3-a517-04013e92ad08,2025-03-05 02:34:14.367958
ANALISTA (CODIGO DE AIRHSP – 000376),UNIVERSIDAD NACIONAL DE HUANCAVELICA,HUANCAVELICA - HUANCAVELICA,276-003,1,"S/. 2,833.00",03/03/2025,14/03/2025,c6ab48de-c113-4f9e-a531-c0b0454fa011,2025-03-05 02:34:14.367958
GESTORES DE DESARROLLO SOCIAL,PROGRAMA NACIONAL DE APOYO DIRECTO A LOS MAS POBRES,HUANCAVELICA - HUANCAVELICA,D.LEG 1057 - DETERMINADO (NECESIDAD TRANSITORIA)-058,2,"S/. 3,000.00",03/03/2025,14/03/2025,d07be0b7-8fa3-427d-9bda-5e6ee35d0cef,2025-03-05 02:34:14.367958
TECNICO EN INGENIERÍA II,GERENCIA SUB REGIONAL TAYACAJA,HUANCAVELICA - PAMPAS,276-002,1,"S/. 2,678.00",03/03/2025,14/03/2025,286bc596-27a0-4002-9d45-f9c664e90f6f,2025-03-05 02:34:14.367958
GESTOR/A INSTITUCIONAL,PROGRAMA NACIONAL ÑPLATAFORMAS DE ACCIÓN PARA LA INCLUSIÓN SOCIAL-PAISÑ,HUANCAVELICA - CASTROVIRREYNA,D.LEG 1057 - DETERMINADO (NECESIDAD TRANSITORIA)-028,1,"S/. 3,000.00",03/03/2025,14/03/2025,f7467f85-db52-41f2-9e6c-fd52402f5fac,2025-03-05 02:34:14.367958
ESPECIALISTA EN RECURSOS HUMANOS,UNIDAD EJECUTORA 403 RED DE SALUD TAYACAJA,HUANCAVELICA - PAMPAS,D.LEG 1057 - DETERMINADO (NECESIDAD TRANSITORIA)-002,1,"S/. 3,764.19",28/02/2025,13/03/2025,ee48f93e-2e5c-4968-8c40-b0b5d5a06df9,2025-03-05 02:34:14.367958
QUIMICO FARMACEUTICO,UNIDAD EJECUTORA 403 RED DE SALUD TAYACAJA,HUANCAVELICA - PAMPAS,D.LEG 1057 - DETERMINADO (NECESIDAD TRANSITORIA)-002,1,"S/. 3,164.19",28/02/2025,13/03/2025,b28e3ee8-e35c-41e1-ab39-4c0f76f9bad2,2025-03-05 02:34:14.367958
INGENIERO ELECTRONICO,UNIDAD EJECUTORA 403 RED DE SALUD TAYACAJA,HUANCAVELICA - PAMPAS,D.LEG 1057 - DETERMINADO (NECESIDAD TRANSITORIA)-002,1,"S/. 3,764.19",28/02/2025,13/03/2025,d10875f4-281c-4230-ad7c-e2822de07206,2025-03-05 02:34:14.367958
INGENIERO AMBIENTAL,UNIDAD EJECUTORA 403 RED DE SALUD TAYACAJA,HUANCAVELICA - PAMPAS,D.LEG 1057 - DETERMINADO (NECESIDAD TRANSITORIA)-002,1,"S/. 3,264.19",28/02/2025,13/03/2025,aaac2f24-1c09-4258-8689-895f9d28dcc7,2025-03-05 02:34:14.367958
BIOLOGO,UNIDAD EJECUTORA 403 RED DE SALUD TAYACAJA,HUANCAVELICA - PAMPAS,D.LEG 1057 - DETERMINADO (NECESIDAD TRANSITORIA)-002,1,"S/. 3,164.19",28/02/2025,13/03/2025,ea8ad34b-e199-45ef-8204-982e62e0eca4,2025-03-05 02:34:14.367958
PROGRAMADOR LOGISTICO,UNIDAD EJECUTORA 403 RED DE SALUD TAYACAJA,HUANCAVELICA - PAMPAS,D.LEG 1057 - DETERMINADO (NECESIDAD TRANSITORIA)-002,1,"S/. 3,264.19",28/02/2025,13/03/2025,2fe46e4f-f4a9-4c4f-9f5c-3cffa6d8d155,2025-03-05 02:34:14.367958
BIOLOGO,UNIDAD EJECUTORA 403 RED DE SALUD TAYACAJA,HUANCAVELICA - COLCABAMBA,D.LEG 1057 - DETERMINADO (NECESIDAD TRANSITORIA)-002,2,"S/. 3,164.19",28/02/2025,13/03/2025,161c39b2-505e-4d67-a9a5-55c95f33ed18,2025-03-05 02:34:14.367958
TECNOLOGO MEDICO RADIOLOGO,UNIDAD EJECUTORA 403 RED DE SALUD TAYACAJA,HUANCAVELICA - DANIEL HERNANDEZ,D.LEG 1057 - DETERMINADO (NECESIDAD TRANSITORIA)-002,1,"S/. 4,264.19",28/02/2025,13/03/2025,8d1559b4-f270-45e9-ad2a-be5f0c26c974,2025-03-05 02:34:14.367958
OBSTETRA,UNIDAD EJECUTORA 403 RED DE SALUD TAYACAJA,HUANCAVELICA - HUACHOCOLPA,D.LEG 1057 - DETERMINADO (NECESIDAD TRANSITORIA)-002,1,"S/. 3,164.00",28/02/2025,13/03/2025,11a93de9-663e-48cd-a1fe-2a6dde0bfa33,2025-03-05 02:34:14.367958
ENFERMERA/O,UNIDAD EJECUTORA 403 RED DE SALUD TAYACAJA,HUANCAVELICA - SALCABAMBA,D.LEG 1057 - DETERMINADO (NECESIDAD TRANSITORIA)-002,1,"S/. 3,164.00",28/02/2025,13/03/2025,b783414f-f8c1-42c7-af72-9db3048f213a,2025-03-05 02:34:14.367958
MEDICO CIRUJANO,UNIDAD EJECUTORA 403 RED DE SALUD TAYACAJA,HUANCAVELICA - ACRAQUIA,D.LEG 1057 - DETERMINADO (NECESIDAD TRANSITORIA)-002,1,"S/. 5,464.19",28/02/2025,13/03/2025,4e595791-5d8b-4944-a08d-b16e27fa5aeb,2025-03-05 02:34:14.367958
PUESTO LOGISTICA ABASTECIMIENTO,MUNICIPALIDAD DISTRITAL DE SAN ANTONIO DE CUSICANCHA,HUANCAVELICA - SAN ANTONIO DE CUSICANCHA,D.LEG 1057 - DETERMINADO (NECESIDAD TRANSITORIA)-01,1,"S/. 2,069.00",27/02/2025,12/03/2025,a5f70b1c-7eef-40c2-bed2-d04b92e8ab58,2025-03-05 02:34:14.367958
PUESTO INFRAESTRUCTURA DESARROLLO URBANO,MUNICIPALIDAD DISTRITAL DE SAN ANTONIO DE CUSICANCHA,HUANCAVELICA - SAN ANTONIO DE CUSICANCHA,D.LEG 1057 - DETERMINADO (NECESIDAD TRANSITORIA)-1,1,"S/. 2,414.00",27/02/2025,12/03/2025,88fcabea-961b-44ca-a505-6d186175aaeb,2025-03-05 02:34:14.367958
PUESTO TESORERIA,MUNICIPALIDAD DISTRITAL DE SAN ANTONIO DE CUSICANCHA,HUANCAVELICA - SAN ANTONIO DE CUSICANCHA,D.LEG 1057 - DETERMINADO (NECESIDAD TRANSITORIA)-1,1,"S/. 2,069.00",27/02/2025,12/03/2025,1418ddea-5305-40c8-8716-e1870e30c87b,2025-03-05 02:34:14.367958
ABOGADO/A FORMALIZACIÓN INTEGRAL,ORGANISMO DE FORMALIZACION DE LA PROPIEDAD INFORMAL - COFOPRI,HUANCAVELICA - ASCENSION,D.LEG 1057 - DETERMINADO (NECESIDAD TRANSITORIA)-0039,1,"S/. 4,500.00",27/02/2025,12/03/2025,49d12e97-b161-437a-ad9d-b20ced27c814,2025-03-05 02:34:14.367958
ADMINISTRADOR/A DE OFICINA ZONAL,ORGANISMO DE FORMALIZACION DE LA PROPIEDAD INFORMAL - COFOPRI,HUANCAVELICA - ASCENSION,D.LEG 1057 - DETERMINADO (NECESIDAD TRANSITORIA)-0040,1,"S/. 4,500.00",27/02/2025,12/03/2025,40f650ad-461a-4951-ace5-22b896f6fba9,2025-03-05 02:34:14.367958
TECNOLOGO MEDICO,UNIDAD EJECUTORA 404 RED DE SALUD ACOBAMBA,HUANCAVELICA - ACOBAMBA,D.LEG 1057 - DETERMINADO (NECESIDAD TRANSITORIA)-02,1,"S/. 3,164.19",25/02/2025,10/03/2025,c8ea0c1d-0744-4dd2-8ca9-ef29a7791571,2025-03-05 02:34:14.367958
ANALISTA DE RECURSOS HUMANOS,GOBIERNO REGIONAL HVCA-AGRICULTURA,HUANCAVELICA - HUANCAVELICA,D.LEG 1057 - DETERMINADO (NECESIDAD TRANSITORIA)-002,1,"S/. 2,164.19",25/02/2025,10/03/2025,a3f49ac6-696e-48e0-a569-5ab5e0f72b29,2025-03-05 02:34:14.367958
TECNICO EN FARMACIA,UNIDAD EJECUTORA 404 RED DE SALUD ACOBAMBA,HUANCAVELICA - ACOBAMBA,D.LEG 1057 - DETERMINADO (NECESIDAD TRANSITORIA)-02,1,"S/. 1,764.19",25/02/2025,10/03/2025,3c0816b4-66ff-48f3-8bdc-18a4640e67ae,2025-03-05 02:34:14.367958
OBSTETRA,UNIDAD EJECUTORA 404 RED DE SALUD ACOBAMBA,HUANCAVELICA - ACOBAMBA,D.LEG 1057 - DETERMINADO (NECESIDAD TRANSITORIA)-02,1,"S/. 2,564.19",25/02/2025,10/03/2025,2c26a5cd-c9b4-4cf8-8694-58e340ac9c36,2025-03-05 02:34:14.367958
OBSTETRA,HOSPITAL DE PAMPAS DE TAYACAJA,HUANCAVELICA - PAMPAS,D.LEG 1057 - DETERMINADO (SUPLENCIA)-03,1,"S/. 3,164.19",25/02/2025,10/03/2025,ee063ad4-b10c-4aff-96df-8d13aa50bd7c,2025-03-05 02:34:14.367958
MEDICO,UNIDAD EJECUTORA 404 RED DE SALUD ACOBAMBA,HUANCAVELICA - ACOBAMBA,D.LEG 1057 - DETERMINADO (NECESIDAD TRANSITORIA)-02,3,"S/. 5,464.19",25/02/2025,10/03/2025,9fa82cf9-e482-44ae-be65-912f4d14dfcc,2025-03-05 02:34:14.367958
JEFE DE LEGAJOS,UNIDAD EJECUTORA 404 RED DE SALUD ACOBAMBA,HUANCAVELICA - ACOBAMBA,D.LEG 1057 - DETERMINADO (NECESIDAD TRANSITORIA)-02,1,"S/. 1,764.19",25/02/2025,10/03/2025,17ea2f43-49da-46b3-a4d3-23260d3318ba,2025-03-05 02:34:14.367958
ENFERMERA/O,UNIDAD EJECUTORA 404 RED DE SALUD ACOBAMBA,HUANCAVELICA - ACOBAMBA,D.LEG 1057 - DETERMINADO (SUPLENCIA)-02,1,"S/. 2,564.09",25/02/2025,10/03/2025,807b69a7-a4b0-46b9-9bac-9d348dd4e309,2025-03-05 02:34:14.367958
SECRETARIA/O V,GOBIERNO REGIONAL HVCA-AGRICULTURA,HUANCAVELICA - HUANCAVELICA,276-002,1,"S/. 1,227.00",25/02/2025,10/03/2025,0e0a1681-a608-4e12-9a34-aebfc31cbb50,2025-03-05 02:34:14.367958
TECNICO AGROPECUARIO III,GOBIERNO REGIONAL HVCA-AGRICULTURA,HUANCAVELICA - HUANCAVELICA,276-002,1,"S/. 1,219.00",25/02/2025,10/03/2025,d18d47d0-97ec-415f-95e6-0497bdecb642,2025-03-05 02:34:14.367958
TECNICO EN SEGURIDAD I,GOBIERNO REGIONAL HVCA-AGRICULTURA,HUANCAVELICA - HUANCAVELICA,276-002,1,"S/. 1,210.00",25/02/2025,10/03/2025,e6b6a956-98fb-4300-8c39-7450aef96ac0,2025-03-05 02:34:14.367958
TECNICO EN LABORATORIO,UNIDAD EJECUTORA 405 RED DE SALUD ANGARAES,HUANCAVELICA - LIRCAY,D.LEG 1057 - DETERMINADO (NECESIDAD TRANSITORIA)-2,1,"S/. 2,064.19",25/02/2025,10/03/2025,ab250b9c-212f-4949-8229-7b37fedac5dd,2025-03-05 02:34:14.367958
TECNICO EN ENFERMERIA,UNIDAD EJECUTORA 405 RED DE SALUD ANGARAES,HUANCAVELICA - LIRCAY,D.LEG 1057 - DETERMINADO (NECESIDAD TRANSITORIA)-2,1,"S/. 2,064.19",25/02/2025,10/03/2025,2762faad-5895-490c-85cb-1b77ace7c5a2,2025-03-05 02:34:14.367958
TECNICO EN ENFERMERIA,UNIDAD EJECUTORA 405 RED DE SALUD ANGARAES,HUANCAVELICA - LIRCAY,D.LEG 1057 - DETERMINADO (NECESIDAD TRANSITORIA)-2,1,"S/. 1,764.19",25/02/2025,10/03/2025,fb7fe10a-3c2c-4344-8e65-6973590909fb,2025-03-05 02:34:14.367958
MEDICO,UNIDAD EJECUTORA 405 RED DE SALUD ANGARAES,HUANCAVELICA - LIRCAY,D.LEG 1057 - DETERMINADO (NECESIDAD TRANSITORIA)-2,1,"S/. 6,764.19",25/02/2025,10/03/2025,95071ff7-a1a1-40aa-9a73-83529ee14c6e,2025-03-05 02:34:14.367958
MEDICO,UNIDAD EJECUTORA 405 RED DE SALUD ANGARAES,HUANCAVELICA - LIRCAY,D.LEG 1057 - DETERMINADO (NECESIDAD TRANSITORIA)-2,1,"S/. 5,464.19",25/02/2025,10/03/2025,b343a2c3-0343-48ad-812b-ef901f39c663,2025-03-05 02:34:14.367958
INGENIERO I,UNIDAD EJECUTORA 405 RED DE SALUD ANGARAES,HUANCAVELICA - LIRCAY,D.LEG 1057 - DETERMINADO (NECESIDAD TRANSITORIA)-2,1,"S/. 3,264.19",25/02/2025,10/03/2025,d22bdeef-1a47-4db9-9233-0ca217d283b4,2025-03-05 02:34:14.367958
ENFERMERA (O),UNIDAD EJECUTORA 405 RED DE SALUD ANGARAES,HUANCAVELICA - LIRCAY,D.LEG 1057 - DETERMINADO (NECESIDAD TRANSITORIA)-02,1,"S/. 2,764.19",25/02/2025,10/03/2025,f0fab3f7-1b87-4f95-88ec-f65583ee1828,2025-03-05 02:34:14.367958
ANALISTA ADMINISTRATIVO EN SERVICIOS Y ADQUISICIONES DEL ESTADO,UNIDAD DE GESTION EDUCATIVA LOCAL- VENTANILLA,CALLAO - VENTANILLA,D.LEG 1057 - DETERMINADO (SUPLENCIA)-29,1,"S/. 2,407.50",04/03/2025,17/03/2025,b14877ee-3e8c-45ed-a80f-e729f4e7a30b,2025-03-05 02:34:14.367958
ASISTENTE DE RECURSOS HUMANOS Y DE PLANILLA,IAFAS DE LA MARINA DE GUERRA DEL PERU,CALLAO - BELLAVISTA,D.LEG 1057 - DETERMINADO (NECESIDAD TRANSITORIA)-005,1,"S/. 2,500.00",04/03/2025,17/03/2025,887eefa9-1291-4ca4-8a28-14f9f77b1e24,2025-03-05 02:34:14.367958
TÉCNICO DE RECURSOS HUMANOS Y BIENESTAR SOCIAL,IAFAS DE LA MARINA DE GUERRA DEL PERU,CALLAO - BELLAVISTA,D.LEG 1057 - DETERMINADO (NECESIDAD TRANSITORIA)-004,1,"S/. 2,400.00",04/03/2025,17/03/2025,83bd8280-c2cd-40c8-98e5-f847587206eb,2025-03-05 02:34:14.367958
ANALISTA DE SEGURIDAD Y SALUD EN EL TRABAJO 3,AUTORIDAD PORTUARIA NACIONAL,CALLAO - LA PERLA,D.LEG 1057 - DETERMINADO (NECESIDAD TRANSITORIA)-010,1,"S/. 7,000.00",04/03/2025,17/03/2025,cfdb4cd7-3438-445a-a130-b912e8d5d8cc,2025-03-05 02:34:14.367958
ABOGADO II,MUNICIPALIDAD DISTRITAL DE VENTANILLA,CALLAO - VENTANILLA,D.LEG 1057 - DETERMINADO (SUPLENCIA)-0004,1,"S/. 3,500.00",03/03/2025,14/03/2025,4e329b2a-0457-48e7-ae78-5945ef38ca0e,2025-03-05 02:34:14.367958
EDUCADOR(A) MUSICAL DE LA INICIATIVA PEDAGÓGICA ORQUESTANDO,DIRECCION REGIONAL DE EDUCACION DEL CALLAO,CALLAO - BELLAVISTA,D.LEG 1057 - DETERMINADO (NECESIDAD TRANSITORIA)-006,1,"S/. 2,464.19",03/03/2025,14/03/2025,57417bb4-9c07-4049-8720-64961e0770f3,2025-03-05 02:34:14.367958
NOTIFICADOR,MUNICIPALIDAD DISTRITAL DE VENTANILLA,CALLAO - VENTANILLA,D.LEG 1057 - DETERMINADO (NECESIDAD TRANSITORIA)-0005,1,"S/. 2,300.00",03/03/2025,14/03/2025,930e6f38-30f7-4f55-914d-0b0ac7d98338,2025-03-05 02:34:14.367958
APOYO ADMINISTRATIVO,MUNICIPALIDAD DISTRITAL DE VENTANILLA,CALLAO - VENTANILLA,D.LEG 1057 - DETERMINADO (NECESIDAD TRANSITORIA)-0006,1,"S/. 1,700.00",03/03/2025,14/03/2025,6c6cc8aa-a139-4c0c-9092-c5c9ebbd307e,2025-03-05 02:34:14.367958
TECNICO ADMINISTRATIVO,DIRECCION REGIONAL DE EDUCACION DEL CALLAO,CALLAO - BELLAVISTA,D.LEG 1057 - DETERMINADO (NECESIDAD TRANSITORIA)-007,1,"S/. 2,564.19",03/03/2025,14/03/2025,eb68eb3d-bc19-47e7-9b19-3f9458a095a9,2025-03-05 02:34:14.367958
ABOGADO,CORPORACION PERUANA DE AEROPUERTOS Y AVIACION COMERCIAL SOCIEDAD ANONIMA - CORPAC S.A.,CALLAO - CALLAO,728-009,1,"S/. 3,900.00",03/03/2025,14/03/2025,e1c7720f-530e-4d5b-8a1a-98260f43028e,2025-03-05 02:34:14.367958
ABOGADO,DIRECCION REGIONAL DE EDUCACION DEL CALLAO,CALLAO - BELLAVISTA,D.LEG 1057 - DETERMINADO (NECESIDAD TRANSITORIA)-007,1,"S/. 3,264.19",03/03/2025,14/03/2025,ba544897-1003-4afb-a3bb-2785905bd144,2025-03-05 02:34:14.367958
PROFESIONAL EN PSICOLOGÍA,UNIDAD DE GESTION EDUCATIVA LOCAL- VENTANILLA,CALLAO - VENTANILLA,D.LEG 1057 - DETERMINADO (NECESIDAD TRANSITORIA)-26,12,"S/. 2,764.19",28/02/2025,13/03/2025,74451f98-4c7f-4004-93f5-da97e3bedd9f,2025-03-05 02:34:14.367958
PROFESIONAL EN TECNOLOGÍA MÉDICA CON MENCIÓN EN TERAPIA FÍSICA PARA LOS PROGRAMAS DE INTERVENCIÓN TEMPRANA,UNIDAD DE GESTION EDUCATIVA LOCAL- VENTANILLA,CALLAO - VENTANILLA,D.LEG 1057 - DETERMINADO (NECESIDAD TRANSITORIA)-15,1,"S/. 2,964.19",28/02/2025,13/03/2025,4b28fbcc-60db-4e26-b68e-af4664678185,2025-03-05 02:34:14.367958
"PROFESIONAL EN TECNOLOGÍA MÉDICA CON MENCIÓN EN TERAPIA FÍSICA, OCUPACIONAL O DE LENGUAJE PARA CEBE",UNIDAD DE GESTION EDUCATIVA LOCAL- VENTANILLA,CALLAO - VENTANILLA,D.LEG 1057 - DETERMINADO (NECESIDAD TRANSITORIA)-14,2,"S/. 2,964.19",28/02/2025,13/03/2025,f489649a-3bbf-487a-8dec-9317cde245ae,2025-03-05 02:34:14.367958
SUPERVISORES UGEL REGIONES - ARTICULADOR,UNIDAD DE GESTION EDUCATIVA LOCAL- VENTANILLA,CALLAO - VENTANILLA,D.LEG 1057 - DETERMINADO (NECESIDAD TRANSITORIA)-20,1,"S/. 4,764.19",28/02/2025,13/03/2025,656af71c-afd2-45d0-b11e-ca93b3522ac4,2025-03-05 02:34:14.367958
SUPERVISORES UGEL REGIONES - INFRAESTRUCTURA,UNIDAD DE GESTION EDUCATIVA LOCAL- VENTANILLA,CALLAO - VENTANILLA,D.LEG 1057 - DETERMINADO (NECESIDAD TRANSITORIA)-21,1,"S/. 4,764.19",28/02/2025,13/03/2025,152fca6c-2837-4f63-bafb-3991f08bfb27,2025-03-05 02:34:14.367958
SUPERVISORES UGEL REGIONES - LEGAL,UNIDAD DE GESTION EDUCATIVA LOCAL- VENTANILLA,CALLAO - VENTANILLA,D.LEG 1057 - DETERMINADO (NECESIDAD TRANSITORIA)-22,1,"S/. 4,764.19",28/02/2025,13/03/2025,594e9bed-add8-4467-b88b-7778249df041,2025-03-05 02:34:14.367958
SUPERVISORES UGEL REGIONES - PEDAGOGÍA,UNIDAD DE GESTION EDUCATIVA LOCAL- VENTANILLA,CALLAO - VENTANILLA,D.LEG 1057 - DETERMINADO (NECESIDAD TRANSITORIA)-23,1,"S/. 4,764.19",28/02/2025,13/03/2025,d27a2473-a081-43db-a05c-dbf2f00b3880,2025-03-05 02:34:14.367958
TECNICO DEPORTIVO CAS DE NÚCLEO DE LA INICIATIVA PEDAGÓGICA WIÑAQ,UNIDAD DE GESTION EDUCATIVA LOCAL- VENTANILLA,CALLAO - VENTANILLA,D.LEG 1057 - DETERMINADO (NECESIDAD TRANSITORIA)-16,2,"S/. 3,364.19",28/02/2025,13/03/2025,86ce86d4-6231-4ed2-a67c-aa95ddbe1b00,2025-03-05 02:34:14.367958
PERSONAL DE VIGILANCIA,UNIDAD DE GESTION EDUCATIVA LOCAL- VENTANILLA,CALLAO - VENTANILLA,D.LEG 1057 - DETERMINADO (NECESIDAD TRANSITORIA)-13,10,"S/. 1,414.19",28/02/2025,13/03/2025,58d89cc5-8cff-4949-ae01-e87058eb757b,2025-03-05 02:34:14.367958
PSICOLOGO,UNIDAD DE GESTION EDUCATIVA LOCAL- VENTANILLA,CALLAO - VENTANILLA,D.LEG 1057 - DETERMINADO (NECESIDAD TRANSITORIA)-12,8,"S/. 2,764.19",28/02/2025,13/03/2025,8512719b-3bec-4e84-8f3c-920c4638ae48,2025-03-05 02:34:14.367958
AUXILIAR ADMINISTRATIVO,UNIDAD DE GESTION EDUCATIVA LOCAL- VENTANILLA,CALLAO - VENTANILLA,276-9,1,S/. 971.65,28/02/2025,13/03/2025,723246e8-b3bb-43d5-906e-6e297b2eaa98,2025-03-05 02:34:14.367958
OPERARIO I,MUNICIPALIDAD PROVINCIAL DEL CALLAO,CALLAO - CALLAO,728-04,3,"S/. 1,400.00",28/02/2025,13/03/2025,7a8364b2-ca21-4bab-9f02-27744641e369,2025-03-05 02:34:14.367958
COORDINADOR UGEL SAEE,UNIDAD DE GESTION EDUCATIVA LOCAL- VENTANILLA,CALLAO - VENTANILLA,D.LEG 1057 - DETERMINADO (NECESIDAD TRANSITORIA)-17,1,"S/. 5,264.19",28/02/2025,13/03/2025,14b7b77c-33ed-481d-8fca-61274a6edad6,2025-03-05 02:34:14.367958
ESPECIALISTA DE CONVIVENCIA ESCOLAR DE LA UGEL,UNIDAD DE GESTION EDUCATIVA LOCAL- VENTANILLA,CALLAO - VENTANILLA,D.LEG 1057 - DETERMINADO (NECESIDAD TRANSITORIA)-25,1,"S/. 3,764.19",28/02/2025,13/03/2025,2b969d69-fc7a-4f16-984a-e9f9bebea406,2025-03-05 02:34:14.367958
ESPECIALISTAS LEGAL PAS DE UGEL REGIONES,UNIDAD DE GESTION EDUCATIVA LOCAL- VENTANILLA,CALLAO - VENTANILLA,D.LEG 1057 - DETERMINADO (NECESIDAD TRANSITORIA)-19,1,"S/. 5,264.19",28/02/2025,13/03/2025,0650bdeb-cc0c-43a9-9236-b88cadaa23e8,2025-03-05 02:34:14.367958
OPERARIO III,MUNICIPALIDAD PROVINCIAL DEL CALLAO,CALLAO - CALLAO,728-05,25,"S/. 1,600.00",28/02/2025,13/03/2025,b5145579-31cb-40b6-9683-0341f7d519a2,2025-03-05 02:34:14.367958
OPERARIO IV,MUNICIPALIDAD PROVINCIAL DEL CALLAO,CALLAO - CALLAO,728-06,31,"S/. 1,770.00",28/02/2025,13/03/2025,5e914aef-710d-47e2-b5c7-99f65afe3838,2025-03-05 02:34:14.367958
JEFE DE DEPARTAMENTO DE ENFERMERIA,HOSPITAL NACIONAL DANIEL ALCIDES CARRION,CALLAO - BELLAVISTA,276-01,1,S/. 001.00,28/02/2025,13/03/2025,73e6b772-c481-4c2c-802d-031110a47704,2025-03-05 02:34:14.367958
SUPERVISOR GENERAL,MUNICIPALIDAD PROVINCIAL DEL CALLAO,CALLAO - CALLAO,728-07,3,"S/. 2,370.00",28/02/2025,13/03/2025,e21d55a3-2f0d-4bd3-bed0-0cf2229f8f6e,2025-03-05 02:34:14.367958
AUXILIAR DE OFICINA,SUPERINTENDENCIA NACIONAL DE FISCALIZACION LABORAL - SUNAFIL,CALLAO - CALLAO,D.LEG 1057 - DETERMINADO (NECESIDAD TRANSITORIA)-080,1,"S/. 1,500.00",28/02/2025,13/03/2025,75478c9f-614e-4535-ab41-751db7521940,2025-03-05 02:34:14.367958
PERSONAL DE MANTENIMIENTO,UNIDAD DE GESTION EDUCATIVA LOCAL- VENTANILLA,CALLAO - VENTANILLA,D.LEG 1057 - DETERMINADO (NECESIDAD TRANSITORIA)-11,6,"S/. 1,414.19",28/02/2025,13/03/2025,f196e125-53e6-4519-b55a-7cfc2f93af3a,2025-03-05 02:34:14.367958
PROFESIONAL DE APOYO SAEI,UNIDAD DE GESTION EDUCATIVA LOCAL- VENTANILLA,CALLAO - VENTANILLA,D.LEG 1057 - DETERMINADO (NECESIDAD TRANSITORIA)-18,2,"S/. 4,264.19",28/02/2025,13/03/2025,63307244-0c5c-46da-ae4f-518e48a9b87a,2025-03-05 02:34:14.367958
PROFESIONAL II PARA EQUIPO ITINERANTE DE CONVIVENCIA ESCOLAR,UNIDAD DE GESTION EDUCATIVA LOCAL- VENTANILLA,CALLAO - VENTANILLA,D.LEG 1057 - DETERMINADO (NECESIDAD TRANSITORIA)-28,1,"S/. 3,064.19",28/02/2025,13/03/2025,1f97622e-d931-41be-a6a9-6158174379fa,2025-03-05 02:34:14.367958
PROFESIONAL I PARA EQUIPO ITINERANTE DE CONVIVENCIA ESCOLAR,UNIDAD DE GESTION EDUCATIVA LOCAL- VENTANILLA,CALLAO - CALLAO,D.LEG 1057 - DETERMINADO (NECESIDAD TRANSITORIA)-27,1,"S/. 3,064.19",28/02/2025,13/03/2025,b578b3e4-c910-48c9-8f09-8c933e4e831d,2025-03-05 02:34:14.367958
PERSONAL DE LIMPIEZA Y MANTENIMIENTO,UNIDAD DE GESTION EDUCATIVA LOCAL- VENTANILLA,CALLAO - VENTANILLA,D.LEG 1057 - DETERMINADO (NECESIDAD TRANSITORIA)-24,8,"S/. 1,414.19",28/02/2025,13/03/2025,9e006ab1-d374-4c8f-8983-a91e798687b4,2025-03-05 02:34:14.367958
CHOFER,MUNICIPALIDAD PROVINCIAL DEL CALLAO,CALLAO - CALLAO,728-01,2,"S/. 1,540.00",28/02/2025,13/03/2025,e1c3407b-225b-48bc-9c49-4fb4f35e7e63,2025-03-05 02:34:14.367958
CHOFER II,MUNICIPALIDAD PROVINCIAL DEL CALLAO,CALLAO - CALLAO,728-02,1,"S/. 2,300.00",28/02/2025,13/03/2025,0c815e4a-2e50-4b21-a8a1-274f23daa6fe,2025-03-05 02:34:14.367958
COORDINADOR DE INNOVACION Y SOPORTE TECNOLOGICO,UNIDAD DE GESTION EDUCATIVA LOCAL- VENTANILLA,CALLAO - VENTANILLA,D.LEG 1057 - DETERMINADO (NECESIDAD TRANSITORIA)-10,6,"S/. 1,614.19",28/02/2025,13/03/2025,38811d4d-ed06-4c92-9a1b-c6f69e04e3ec,2025-03-05 02:34:14.367958
OPERARIO,MUNICIPALIDAD PROVINCIAL DEL CALLAO,CALLAO - CALLAO,728-03,5,"S/. 1,200.00",28/02/2025,13/03/2025,6f0e7de6-742d-45aa-a0f5-ba88b568e008,2025-03-05 02:34:14.367958
TÉCNICO ESPECIALISTA EN MANTENIMIENTO Y REPARACIÓN DE LOS SISTEMAS DE ARMAS DE LAS UNIDADES NAVALES,MARINA DE GUERRA DEL PERU,CALLAO - CALLAO,D.LEG 1057 - DETERMINADO (NECESIDAD TRANSITORIA)-012,1,"S/. 2,500.00",26/02/2025,11/03/2025,0e44ff8f-aba3-4959-a17c-8d085ad43d94,2025-03-05 02:34:14.367958
ESPECIALISTA EN ABOGACIA,MARINA DE GUERRA DEL PERU,CALLAO - CALLAO,D.LEG 1057 - DETERMINADO (NECESIDAD TRANSITORIA)-013,1,"S/. 5,500.00",26/02/2025,11/03/2025,6317a511-6632-44fd-bb66-596b340efad0,2025-03-05 02:34:14.367958
TÉCNICO ESPECIALISTA EN OPERACIONES DE ENDEUDAMIENTO,MARINA DE GUERRA DEL PERU,CALLAO - LA PERLA,D.LEG 1057 - DETERMINADO (NECESIDAD TRANSITORIA)-017,1,"S/. 3,750.00",26/02/2025,11/03/2025,926534a7-3196-46f9-99a3-dd12781d6456,2025-03-05 02:34:14.367958
ESPECIALISTA EN SISTEMAS,MARINA DE GUERRA DEL PERU,CALLAO - LA PERLA,D.LEG 1057 - DETERMINADO (NECESIDAD TRANSITORIA)-016,1,"S/. 6,600.00",26/02/2025,11/03/2025,193c0a38-87df-4367-9630-62334a91ae5d,2025-03-05 02:34:14.367958
ESPECIALISTA EN PLANEAMIENTO Y PRESUPUESTO PÚBLICO,MARINA DE GUERRA DEL PERU,CALLAO - LA PERLA,D.LEG 1057 - DETERMINADO (NECESIDAD TRANSITORIA)-018,1,"S/. 5,550.00",26/02/2025,11/03/2025,5b3828f8-248e-4a6f-ade0-e934f2d055d1,2025-03-05 02:34:14.367958
ESPECIALISTA EN COMUNICACIÓN,MARINA DE GUERRA DEL PERU,CALLAO - LA PERLA,D.LEG 1057 - DETERMINADO (NECESIDAD TRANSITORIA)-014,1,"S/. 5,000.00",26/02/2025,11/03/2025,b95e3c3a-266f-4fcd-9fcf-1c9234667645,2025-03-05 02:34:14.367958
DISEÑADOR GRÁFICO,MARINA DE GUERRA DEL PERU,CALLAO - LA PERLA,D.LEG 1057 - DETERMINADO (NECESIDAD TRANSITORIA)-015,1,"S/. 2,500.00",26/02/2025,11/03/2025,f5574010-998a-480c-a2d7-8a647e5ccf9b,2025-03-05 02:34:14.367958
ESPECIALISTA JUDICIAL DE AUDIENCIA,PODER JUDICIAL,CALLAO - VENTANILLA,D.LEG 1057 - DETERMINADO (NECESIDAD TRANSITORIA)-013,1,"S/. 2,972.00",26/02/2025,11/03/2025,c2f101cf-b8e4-44f7-9495-f735553979ee,2025-03-05 02:34:14.367958
ORIENTADOR(A) DE ATENCIÓN AL USUARIO,SUPERINTENDENCIA NACIONAL DE MIGRACIONES - MIGRACIONES,CALLAO - CALLAO,D.LEG 1057 - DETERMINADO (NECESIDAD TRANSITORIA)-086,1,"S/. 2,000.00",25/02/2025,10/03/2025,f93126ef-d6fb-4870-b763-da928a74d507,2025-03-05 02:34:14.367958
ASISTENTE TÉCNICO DE ARCHIVO,AUTORIDAD DE TRANSPORTE URBANO PARA LIMA Y CALLAO - ATU,CALLAO - CALLAO,D.LEG 1057 - DETERMINADO (NECESIDAD TRANSITORIA)-23,1,"S/. 3,000.00",24/02/2025,07/03/2025,ac9069c9-7eba-4b3f-a6e8-9d4ccfbba04a,2025-03-05 02:34:14.367958
ESPECIALISTA EN ABASTECIMIENTO,UNIDAD EJECUTORA 306 EDUCACION UGEL PUERTO INCA,HUANUCO - PUERTO INCA,D.LEG 1057 - DETERMINADO (SUPLENCIA)-005,1,"S/. 3,114.19",04/03/2025,17/03/2025,fdb864cb-6264-47c7-9a04-69af668ad785,2025-03-05 02:34:14.367958
TECNICO JUDICIAL,PODER JUDICIAL,HUANUCO - HUANUCO,D.LEG 1057 - DETERMINADO (SUPLENCIA)-07,1,"S/. 2,197.00",04/03/2025,17/03/2025,216d7308-5fc7-4f36-8a9c-3c46dc59c491,2025-03-05 02:34:14.367958
ESPECIALISTA REGIONAL EN HIDROCARBUROS,ORGANISMO SUPERVISOR DE LA INVERSION EN ENERGIA Y MINERIA,HUANUCO - HUANUCO,D.LEG 1057 - DETERMINADO (NECESIDAD TRANSITORIA)-25,1,"S/. 11,000.00",04/03/2025,17/03/2025,09532dda-9a5b-4f10-bde5-5091831dbc2c,2025-03-05 02:34:14.367958
ESPECIALISTA DE CALIDAD DEL SERVICIO EDUCATIVO SUPERIOR TECNOLÓGICO,DIRECCION REGIONAL DE EDUCACION Y CULTUR,HUANUCO - HUANUCO,D.LEG 1057 - DETERMINADO (NECESIDAD TRANSITORIA)-002,1,"S/. 3,164.19",04/03/2025,17/03/2025,9eaf154b-bb61-4e11-95f7-d31eef1ee33f,2025-03-05 02:34:14.367958
COORDINADOR DE PRODUCCIÓN ESTADÍSTICA DEPARTAMENTAL/ZONAL - HUÁNUCO,INSTITUTO NACIONAL DE ESTAD. E INFORMATI,HUANUCO - HUANUCO,D.LEG 1057 - DETERMINADO (NECESIDAD TRANSITORIA)-003,1,"S/. 5,650.00",04/03/2025,17/03/2025,53404f40-1b5c-4144-bb73-5c1f1d013bfe,2025-03-05 02:34:14.367958
PILOTO DE AMBULANCIA,UNIDAD EJECUTORA N° 404 RED DE SALUD HUANUCO,HUANUCO - QUISQUI (KICHKI),D.LEG 1057 - DETERMINADO (NECESIDAD TRANSITORIA)-1,1,"S/. 2,064.19",03/03/2025,14/03/2025,e47e04e6-b43a-4173-8a06-97b0a4a28d15,2025-03-05 02:34:14.367958
ENFERMERA/O,UNIDAD EJECUTORA N° 404 RED DE SALUD HUANUCO,HUANUCO - MARGOS,D.LEG 1057 - DETERMINADO (NECESIDAD TRANSITORIA)-1,1,"S/. 3,164.19",03/03/2025,14/03/2025,c957cb85-0623-4139-af1a-46384ccba7a8,2025-03-05 02:34:14.367958
ENFERMERA/O,UNIDAD EJECUTORA N° 404 RED DE SALUD HUANUCO,HUANUCO - MARGOS,D.LEG 1057 - DETERMINADO (NECESIDAD TRANSITORIA)-1,1,"S/. 3,164.19",03/03/2025,14/03/2025,e586534f-ed5a-4e24-b3c0-81673de12e82,2025-03-05 02:34:14.367958
