posicion,empresa,ubicacion,num_conv,n_vac,salario,fecha_inicio,fecha_fin,id_uuid,fechaActualizacion
PSICOLO,UNIDAD DE GESTION EDUCATIVA LOCAL CHOTA,CAJAMARCA - CHOTA,D.LEG 1057 - DETERMINADO (NECESIDAD TRANSITORIA)-3,34,"S/. 2,764.19",18/02/2025,03/03/2025,f0002799-b68b-4363-8f9d-46135010b756,2025-02-18 18:11:46.117560
PROFESIONAL II,UNIDAD DE GESTION EDUCATIVA LOCAL CHOTA,CAJAMARCA - CHOTA,D.LEG 1057 - DETERMINADO (NECESIDAD TRANSITORIA)-3,1,"S/. 3,064.19",18/02/2025,03/03/2025,ac7bea2d-f972-44ee-8417-db99a5550e86,2025-02-18 18:11:46.117560
PERSONAL DE MANTENIMIENTO,UNIDAD DE GESTION EDUCATIVA LOCAL CHOTA,CAJAMARCA - CHOTA,D.LEG 1057 - DETERMINADO (NECESIDAD TRANSITORIA)-3,12,"S/. 1,414.19",18/02/2025,03/03/2025,b09decf5-9d85-4aea-8b52-4700c94b0b23,2025-02-18 18:11:46.117560
PROFESIONAL I,UNIDAD DE GESTION EDUCATIVA LOCAL CHOTA,CAJAMARCA - CHOTA,D.LEG 1057 - DETERMINADO (NECESIDAD TRANSITORIA)-3,1,"S/. 3,064.19",18/02/2025,03/03/2025,22f2b094-8cea-4e15-b1ff-1557452cda76,2025-02-18 18:11:46.117560
COORDINADOR DE INNOVACION Y SOPORTE TECNOLOGICO,UNIDAD DE GESTION EDUCATIVA LOCAL CHOTA,CAJAMARCA - CHOTA,D.LEG 1057 - DETERMINADO (NECESIDAD TRANSITORIA)-3,34,"S/. 1,614.19",18/02/2025,03/03/2025,1fac38c3-0c12-42c0-8d8d-a77230a3ac2d,2025-02-18 18:11:46.117560
UN (01) ESPECIALISTA EN INOCUIDAD ALIMENTARIA Y SALUD AMBIENTAL- REGIÓN CAJAMARCA,MINISTERIO DE SALUD,CAJAMARCA - CAJAMARCA,D.LEG 1057 - DETERMINADO (NECESIDAD TRANSITORIA)-25,1,"S/. 8,000.00",18/02/2025,03/03/2025,03bfd0fd-41b7-49ca-992a-1f5b80a5a914,2025-02-18 18:11:46.117560
JEFE  PARA LA UNIDAD FORMULADORA,MUNICIPALIDAD DISTRITAL DE LA ENCAÑADA,CAJAMARCA - ENCAÑADA,D.LEG 1057 - DETERMINADO (NECESIDAD TRANSITORIA)-001,1,"S/. 3,500.00",18/02/2025,03/03/2025,e23ebda8-811e-4b8b-be15-fb5a4be113eb,2025-02-18 18:11:46.117560
PERSONAL DE VIGILANCIA,UNIDAD DE GESTION EDUCATIVA LOCAL CHOTA,CAJAMARCA - CHOTA,D.LEG 1057 - DETERMINADO (NECESIDAD TRANSITORIA)-3,1,"S/. 1,414.19",18/02/2025,03/03/2025,d5608431-0a58-4c5c-bb86-5d9be32a3812,2025-02-18 18:11:46.117560
PROFESIONAL EN TECNOLOGIA MEDICA,UNIDAD DE GESTION EDUCATIVA LOCAL CHOTA,CAJAMARCA - CHOTA,D.LEG 1057 - DETERMINADO (NECESIDAD TRANSITORIA)-3,1,"S/. 2,964.19",18/02/2025,03/03/2025,2f639032-914d-481a-b9f3-a880c48e8f23,2025-02-18 18:11:46.117560
JEFE PARA LA UNIDAD DE EJECUCION DE OBRAS Y MANTENIMIENTO,MUNICIPALIDAD DISTRITAL DE LA ENCAÑADA,CAJAMARCA - ENCAÑADA,D.LEG 1057 - DETERMINADO (NECESIDAD TRANSITORIA)-001,1,"S/. 3,500.00",18/02/2025,03/03/2025,c82b9167-b7a1-427e-8c47-32d3d7f4aa55,2025-02-18 18:11:46.117560
JEFE PARA LA UNIDAD DE CONTABILIDAD,MUNICIPALIDAD DISTRITAL DE LA ENCAÑADA,CAJAMARCA - ENCAÑADA,D.LEG 1057 - DETERMINADO (NECESIDAD TRANSITORIA)-001,1,"S/. 3,500.00",18/02/2025,03/03/2025,143e15c0-0415-4bf1-baae-922caf85023d,2025-02-18 18:11:46.117560
JEFE PARA LA UNIDAD DE CATASTRO,MUNICIPALIDAD DISTRITAL DE LA ENCAÑADA,CAJAMARCA - ENCAÑADA,D.LEG 1057 - DETERMINADO (NECESIDAD TRANSITORIA)-001,1,"S/. 3,500.00",18/02/2025,03/03/2025,0f5b67f8-d811-4864-9183-3ac08bc18d91,2025-02-18 18:11:46.117560
PERSONAL DE LIMPIEZA Y MANTENIMIENTO,UNIDAD DE GESTION EDUCATIVA LOCAL CHOTA,CAJAMARCA - CHOTA,D.LEG 1057 - DETERMINADO (NECESIDAD TRANSITORIA)-3,1,"S/. 1,414.19",18/02/2025,03/03/2025,f5d8a8e5-3804-4337-892e-6e04793358dd,2025-02-18 18:11:46.117560
DEFENSOR PUBLICO DE ASISTENCIA LEGAL,MINISTERIO DE JUSTICIA Y DERECHOS HUMANOS,CAJAMARCA - CAJABAMBA,D.LEG 1057 - DETERMINADO (SUPLENCIA)-163,1,"S/. 5,264.19",17/02/2025,28/02/2025,0123124f-4ac7-42a7-b54a-2491983f29b0,2025-02-18 18:11:46.117560
APOYO ADMINISTRATIVO EN EL REGISTRO NACIONAL DE DEUDORES ALIMENTARIOS Y MOROSOS,PODER JUDICIAL,CAJAMARCA - CAJAMARCA,D.LEG 1057 - DETERMINADO (SUPLENCIA)-007,1,"S/. 1,420.00",17/02/2025,28/02/2025,1dd3837e-002d-40d2-9b8f-c7db5f9459b2,2025-02-18 18:11:46.117560
"APOYO EN LA ELABORACIÓN DE INFORMES, TRANSCRIPCIONES Y PROYECCIONES DE RESOLUCIONES",PODER JUDICIAL,CAJAMARCA - CAJAMARCA,D.LEG 1057 - DETERMINADO (SUPLENCIA)-007,1,S/. 001.00,17/02/2025,28/02/2025,deda63b6-471f-44f7-a3b2-438a105b6ebd,2025-02-18 18:11:46.117560
GESTOR LOCAL,PROGRAMA NACIONAL DE APOYO DIRECTO A LOS MAS POBRES,CAJAMARCA - CAJAMARCA,D.LEG 1057 - DETERMINADO (SUPLENCIA)-039,1,"S/. 2,000.00",17/02/2025,28/02/2025,153aaa6b-fa7e-4128-aa16-247de3b26199,2025-02-18 18:11:46.117560
COORDINADOR TECNICO ZONAL,PROGRAMA NACIONAL DE APOYO DIRECTO A LOS MAS POBRES,CAJAMARCA - CAJAMARCA,D.LEG 1057 - DETERMINADO (NECESIDAD TRANSITORIA)-041,1,"S/. 3,500.00",17/02/2025,28/02/2025,9423a6c5-c558-4f83-98fc-63538cd3a201,2025-02-18 18:11:46.117560
TÉCNICO ADMINISTRATIVO (I) SECRETARIA,UNIDAD DE GESTION EDUCATIVA LOCAL DE LA PROVINCIA DE SANTA CRUZ,CAJAMARCA - SANTA CRUZ,D.LEG 1057 - DETERMINADO (NECESIDAD TRANSITORIA)-02,1,S/. 001.91,17/02/2025,28/02/2025,890a9f6b-cb42-4402-9464-c98618eded21,2025-02-18 18:11:46.117560
ESPECIALISTA EN FINANZAS I,UNIDAD DE GESTION EDUCATIVA LOCAL DE LA PROVINCIA DE SANTA CRUZ,CAJAMARCA - SANTA CRUZ,D.LEG 1057 - DETERMINADO (NECESIDAD TRANSITORIA)-02,1,"S/. 2,600.00",17/02/2025,28/02/2025,7743d4a4-be57-4c1c-bf70-cc69ae819256,2025-02-18 18:11:46.117560
TÉCNICO ADMINISTRATIVO I (ALMACÉN),UNIDAD DE GESTION EDUCATIVA LOCAL DE LA PROVINCIA DE SANTA CRUZ,CAJAMARCA - SANTA CRUZ,D.LEG 1057 - DETERMINADO (NECESIDAD TRANSITORIA)-02,1,S/. 001.91,17/02/2025,28/02/2025,e2841f40-ca1c-434b-9e5d-f7bf09d34266,2025-02-18 18:11:46.117560
"JEFE DE LA SUBGERENCIA DE DESARROLLO ECONÓMICO, SERVICIOS MUNICIPALES Y GESTIÓN AMBIENTAL",MUNICIPALIDAD DISTRITAL DE SAN LUIS,CAJAMARCA - SAN LUIS,D.LEG 1057 - DETERMINADO (NECESIDAD TRANSITORIA)-02,1,"S/. 2,000.00",17/02/2025,28/02/2025,6731d020-6723-48ec-85ba-a1ae4d98c1a3,2025-02-18 18:11:46.117560
DEFENSOR PUBLICO EN EL NUEVO CODIGO PROCESAL PENAL,MINISTERIO DE JUSTICIA Y DERECHOS HUMANOS,CAJAMARCA - PEDRO GALVEZ,D.LEG 1057 - DETERMINADO (SUPLENCIA)-162,1,"S/. 5,264.19",17/02/2025,28/02/2025,b8ac9a98-d105-4883-8234-13c945916743,2025-02-18 18:11:46.117560
PSICOLOGO,UNIDAD DE GESTION EDUCATIVA LOCAL CONTUMAZA,CAJAMARCA - CONTUMAZA,D.LEG 1057 - DETERMINADO (NECESIDAD TRANSITORIA)-01,4,"S/. 2,764.19",14/02/2025,27/02/2025,8ef30c0f-5659-4c40-96d7-c9180190f700,2025-02-18 18:11:46.117560
ESPECIALISTA EN PROCESOS ADMINISTRATIVOS DISCIPLINARIOS,UNIDAD DE GESTION EDUCATIVA LOCAL CONTUMAZA,CAJAMARCA - CONTUMAZA,D.LEG 1057 - DETERMINADO (NECESIDAD TRANSITORIA)-002,1,"S/. 2,764.19",14/02/2025,27/02/2025,b9c45c0f-383f-4afb-9996-fca8ba60e0db,2025-02-18 18:11:46.117560
UN/A (01) PROFESIONAL SOCIAL COMUNITARIO PARA EL TRABAJO CON  HOMBRES - CEM SAN IGNACIO - CAJAMARCA,PROGR NAC PARA LA PREVENC Y ERRADIC DE LA VIOLENCIA CONTRA LAS MUJERES E INTEG DEL GRUP FAM-AURORA,CAJAMARCA - SAN IGNACIO,D.LEG 1057 - DETERMINADO (NECESIDAD TRANSITORIA)-030,1,"S/. 4,000.00",14/02/2025,27/02/2025,5c735e34-800d-4203-99b8-e966534c3e3c,2025-02-18 18:11:46.117560
INGENIERO EVALUADOR Y FORMULADOR DE PROYECTOS DE INVERSIÓN PÚBLICA,MUNICIPALIDAD PROVINCIAL DE CAJAMARCA,CAJAMARCA - CAJAMARCA,D.LEG 1057 - DETERMINADO (NECESIDAD TRANSITORIA)-001,1,"S/. 3,000.00",14/02/2025,27/02/2025,4ae3df27-42b4-4c41-943e-ade1dc7fdfd1,2025-02-18 18:11:46.117560
EJECUTOR COACTIVO,MUNICIPALIDAD PROVINCIAL DE CAJAMARCA,CAJAMARCA - CAJAMARCA,D.LEG 1057 - DETERMINADO (NECESIDAD TRANSITORIA)-001,1,"S/. 3,500.00",14/02/2025,27/02/2025,c5d93574-e8ea-40ea-b816-d46f4f71f404,2025-02-18 18:11:46.117560
COORDINADOR DE OBRAS POR ADMINISTRACIÓN INDIRECTA,MUNICIPALIDAD PROVINCIAL DE CAJAMARCA,CAJAMARCA - CAJAMARCA,D.LEG 1057 - DETERMINADO (NECESIDAD TRANSITORIA)-001,1,"S/. 4,000.00",14/02/2025,27/02/2025,cb6b8761-50c4-47a4-b890-7e360d7d23b0,2025-02-18 18:11:46.117560
COORDINADOR DE CULTURA,MUNICIPALIDAD PROVINCIAL DE CAJAMARCA,CAJAMARCA - CAJAMARCA,D.LEG 1057 - DETERMINADO (NECESIDAD TRANSITORIA)-001,1,"S/. 4,000.00",14/02/2025,27/02/2025,7578bba1-abb6-4560-9dc3-ca949db9cb14,2025-02-18 18:11:46.117560
ESPECIALISTA EN MAIZ,INSTITUTO NACIONAL DE INNOVACION AGRARIA,CAJAMARCA - LOS BAÑOS DEL INCA,728-034,1,S/. 001.00,14/02/2025,27/02/2025,70de50d7-6a4f-4acf-bb3a-fa6e50882a74,2025-02-18 18:11:46.117560
PERSONAL DE MANTENIMIENTO,UNIDAD DE GESTION EDUCATIVA LOCAL CONTUMAZA,CAJAMARCA - CHILETE,D.LEG 1057 - DETERMINADO (NECESIDAD TRANSITORIA)-01,1,"S/. 1,414.19",14/02/2025,27/02/2025,52993690-eed5-421f-826f-8936c3073d3d,2025-02-18 18:11:46.117560
COORDINADOR (A) DE INNOVACIÓN Y SOPORTE TECNOLÓGICO,UNIDAD DE GESTION EDUCATIVA LOCAL CONTUMAZA,CAJAMARCA - CONTUMAZA,D.LEG 1057 - DETERMINADO (NECESIDAD TRANSITORIA)-01,3,"S/. 1,614.19",14/02/2025,27/02/2025,f3e80044-d9a5-4985-9d9c-11f514befef0,2025-02-18 18:11:46.117560
PERSONAL DE VIGILANCIA,UNIDAD DE GESTION EDUCATIVA LOCAL CONTUMAZA,CAJAMARCA - CONTUMAZA,D.LEG 1057 - DETERMINADO (NECESIDAD TRANSITORIA)-01,1,"S/. 1,414.19",14/02/2025,27/02/2025,794f2c5a-d026-44ad-b12f-a60e6f6bbbfe,2025-02-18 18:11:46.117560
"PROFESIONAL EN TECNOLOGÍA MÉDICA CON MENCIÓN EN TERAPIA FÍSICA, OCUPACIONAL O DE LENGUAJE PARA CEBE",UNIDAD DE GESTION EDUCATIVA LOCAL CONTUMAZA,CAJAMARCA - CONTUMAZA,D.LEG 1057 - DETERMINADO (NECESIDAD TRANSITORIA)-01,2,"S/. 2,964.19",14/02/2025,27/02/2025,ba2ed7b5-b685-492d-b092-8b6555f6932d,2025-02-18 18:11:46.117560
TÉCNICO/A EN FARMACIA,UNIDAD EJECUTORA SALUD SAN IGNACIO,CAJAMARCA - SAN IGNACIO,D.LEG 1057 - DETERMINADO (NECESIDAD TRANSITORIA)-2,1,"S/. 1,200.00",13/02/2025,26/02/2025,ae7e2fb6-37dc-47f0-8521-bdb353a09d84,2025-02-18 18:11:46.117560
OBSTETRA,HOSPITAL SANTA MARIA DE CUTERVO,CAJAMARCA - CUTERVO,D.LEG 1057 - DETERMINADO (NECESIDAD TRANSITORIA)-2,1,"S/. 2,064.19",13/02/2025,26/02/2025,ac15d54b-ce07-4b3c-8692-4652c542798c,2025-02-18 18:11:46.117560
MÉDICO ESPECIALISTA EN PEDIATRÍA,HOSPITAL SANTA MARIA DE CUTERVO,CAJAMARCA - CUTERVO,D.LEG 1057 - DETERMINADO (NECESIDAD TRANSITORIA)-2,1,"S/. 8,264.19",13/02/2025,26/02/2025,4ae340eb-42a0-43b2-91ed-09c0a91ceff7,2025-02-18 18:11:46.117560
TÉCNICO/A EN ENFERMERIA,UNIDAD EJECUTORA SALUD SAN IGNACIO,CAJAMARCA - SAN IGNACIO,D.LEG 1057 - DETERMINADO (NECESIDAD TRANSITORIA)-1,1,"S/. 1,800.00",13/02/2025,26/02/2025,a666841b-a528-46d3-a246-21bbc8950cb8,2025-02-18 18:11:46.117560
MÉDICO EN SALUD OCUPACIONAL,HOSPITAL SANTA MARIA DE CUTERVO,CAJAMARCA - CUTERVO,D.LEG 1057 - DETERMINADO (NECESIDAD TRANSITORIA)-2,1,"S/. 5,464.19",13/02/2025,26/02/2025,d2472ebd-865e-4e63-a6eb-b5104ec28c76,2025-02-18 18:11:46.117560
GERENCIA DE TURISMO Y MEDIO AMBIENTE,MUNICIPALIDAD DISTRITAL DE UTCO,CAJAMARCA - UTCO,D.LEG 1057 - DETERMINADO (NECESIDAD TRANSITORIA)-01,1,"S/. 2,500.00",13/02/2025,26/02/2025,1d58475a-8f19-4967-adcc-8bc299b5ced4,2025-02-18 18:11:46.117560
SUBGERENTE DE PRE INVERSION,MUNICIPALIDAD DISTRITAL DE UTCO,CAJAMARCA - UTCO,D.LEG 1057 - DETERMINADO (NECESIDAD TRANSITORIA)-01,1,"S/. 3,000.00",13/02/2025,26/02/2025,81ef986e-2436-4606-b17b-2b10558e44ba,2025-02-18 18:11:46.117560
PROFESIONAL III PARA EQUIPO ITINERANTE DE CONVIVENCIA ESCOLAR,UNIDAD DE GESTION EDUCATIVA LOCAL SAN MARCOS - UGEL SAN MARCOS,CAJAMARCA - PEDRO GALVEZ,D.LEG 1057 - DETERMINADO (NECESIDAD TRANSITORIA)-9,1,"S/. 3,064.19",13/02/2025,26/02/2025,25f84796-1d92-4b9d-a983-9a66eb8ba0cc,2025-02-18 18:11:46.117560
PSICOLOGO,UNIDAD DE GESTION EDUCATIVA LOCAL SAN MARCOS - UGEL SAN MARCOS,CAJAMARCA - PEDRO GALVEZ,D.LEG 1057 - DETERMINADO (NECESIDAD TRANSITORIA)-9,7,"S/. 2,764.19",13/02/2025,26/02/2025,69733a10-9af0-4afa-abc9-7b4857c49ed4,2025-02-18 18:11:46.117560
PERSONAL DE MANTENIMIENTO,UNIDAD DE GESTION EDUCATIVA LOCAL SAN MARCOS - UGEL SAN MARCOS,CAJAMARCA - PEDRO GALVEZ,D.LEG 1057 - DETERMINADO (NECESIDAD TRANSITORIA)-9,10,"S/. 1,414.19",13/02/2025,26/02/2025,97fc3564-1814-472f-a632-b84011be2c8f,2025-02-18 18:11:46.117560
COORDINADOR DE INNOVACIÓN  Y SOPORTE TECNOLÓGICO,UNIDAD DE GESTION EDUCATIVA LOCAL SAN MARCOS - UGEL SAN MARCOS,CAJAMARCA - PEDRO GALVEZ,D.LEG 1057 - DETERMINADO (NECESIDAD TRANSITORIA)-9,5,"S/. 1,614.19",13/02/2025,26/02/2025,3f2768af-e0bf-47de-9cb4-d013a11e34b2,2025-02-18 18:11:46.117560
REGISTRO CIVIL,MUNICIPALIDAD DISTRITAL DE UTCO,CAJAMARCA - UTCO,D.LEG 1057 - DETERMINADO (NECESIDAD TRANSITORIA)-01,1,"S/. 1,800.00",13/02/2025,26/02/2025,e50198fb-4b96-4a73-83f6-0accc462cb6a,2025-02-18 18:11:46.117560
RESPONSABLE DE LA OFICINA DE ABASTECIMIENTOS,MUNICIPALIDAD DISTRITAL DE UTCO,CAJAMARCA - UTCO,D.LEG 1057 - DETERMINADO (NECESIDAD TRANSITORIA)-01,1,"S/. 2,500.00",13/02/2025,26/02/2025,ee534697-287d-41b9-88fd-26d6bb2f535f,2025-02-18 18:11:46.117560
PROFESIONAL EN TECNOLOGÍA MÉDICA CON MENCIÓN EN TERAPIA FÍSICA,UNIDAD DE GESTION EDUCATIVA LOCAL SAN MARCOS - UGEL SAN MARCOS,CAJAMARCA - PEDRO GALVEZ,D.LEG 1057 - DETERMINADO (NECESIDAD TRANSITORIA)-9,1,"S/. 2,964.19",13/02/2025,26/02/2025,42922cce-ccfb-422f-8856-7c459c771942,2025-02-18 18:11:46.117560
JEFE DE COMUNICACIONES,UNIDAD DE GESTION EDUCATIVA LOCAL CELENDIN,CAJAMARCA - CELENDIN,D.LEG 1057 - DETERMINADO (SUPLENCIA)-002,1,"S/. 2,064.19",12/02/2025,25/02/2025,16d2b96e-4690-41ee-aed0-7668742dc43b,2025-02-18 18:11:46.117560
TÉCNICO ADMINISTRATIVO I (ALMACÉN),MUNICIPALIDAD DISTRITAL DE UCHURACCAY,AYACUCHO - UCHURACCAY,D.LEG 1057 - DETERMINADO (NECESIDAD TRANSITORIA)-01,1,"S/. 1,600.00",18/02/2025,03/03/2025,2fe8eccb-a61f-4e18-989b-17111cbc0a68,2025-02-18 18:11:46.117560
ESPECIALISTA LEGAL,PODER JUDICIAL,AYACUCHO - CORACORA,D.LEG 1057 - DETERMINADO (NECESIDAD TRANSITORIA)-005,1,"S/. 2,972.00",18/02/2025,03/03/2025,5d864d60-a53f-458e-9e27-4fae00d1e17e,2025-02-18 18:11:46.117560
SECRETARIA EJECUTIVA,MUNICIPALIDAD DISTRITAL DE UCHURACCAY,AYACUCHO - UCHURACCAY,D.LEG 1057 - DETERMINADO (NECESIDAD TRANSITORIA)-001,1,"S/. 2,200.00",18/02/2025,03/03/2025,a46b0d97-10a1-49d6-8b8e-1cb3bb32123e,2025-02-18 18:11:46.117560
"PROMOTOR SOCIAL, RESP. DE DEMUNA, OMAPED Y CIAM:",MUNICIPALIDAD DISTRITAL DE UCHURACCAY,AYACUCHO - UCHURACCAY,D.LEG 1057 - DETERMINADO (NECESIDAD TRANSITORIA)-01,1,"S/. 1,900.00",18/02/2025,03/03/2025,3454b29d-00bd-4885-9861-f7fc33c48705,2025-02-18 18:11:46.117560
"OPERADOR DE MAQUINARIA PESADA, RETROEXCAVADORA",MUNICIPALIDAD DISTRITAL DE UCHURACCAY,AYACUCHO - UCHURACCAY,D.LEG 1057 - DETERMINADO (NECESIDAD TRANSITORIA)-01,1,"S/. 2,300.00",18/02/2025,03/03/2025,92f51b05-e009-47f5-9163-07ea8fcce2d7,2025-02-18 18:11:46.117560
"OPERADOR DE MAQUINARIA PESADA, EXCAVADORA",MUNICIPALIDAD DISTRITAL DE UCHURACCAY,AYACUCHO - UCHURACCAY,D.LEG 1057 - DETERMINADO (NECESIDAD TRANSITORIA)-01,1,"S/. 2,800.00",18/02/2025,03/03/2025,1607ca6d-9083-4ee1-8de2-d4673a8cac4e,2025-02-18 18:11:46.117560
JEFE DE UNIDAD DE ABASTECIMIENTO,MUNICIPALIDAD DISTRITAL DE UCHURACCAY,AYACUCHO - UCHURACCAY,D.LEG 1057 - DETERMINADO (NECESIDAD TRANSITORIA)-01,1,"S/. 2,400.00",18/02/2025,03/03/2025,3dde17ff-53f7-426a-9c0b-75bad629697c,2025-02-18 18:11:46.117560
JEFE DE RECURSOS HUMANOS,MUNICIPALIDAD DISTRITAL DE UCHURACCAY,AYACUCHO - UCHURACCAY,D.LEG 1057 - DETERMINADO (NECESIDAD TRANSITORIA)-01,1,"S/. 2,200.00",18/02/2025,03/03/2025,225ea930-9258-4e4b-915a-6de62bd27fc5,2025-02-18 18:11:46.117560
ESPECIALISTA EN TRIBUTACIÓN II,MUNICIPALIDAD DISTRITAL DE UCHURACCAY,AYACUCHO - UCHURACCAY,D.LEG 1057 - DETERMINADO (NECESIDAD TRANSITORIA)-01,1,"S/. 1,900.00",18/02/2025,03/03/2025,04263f00-43fb-4c93-85b2-6da062cbdf64,2025-02-18 18:11:46.117560
ESPECIALISTA JUDICIAL DE SALA,PODER JUDICIAL,AYACUCHO - AYACUCHO,D.LEG 1057 - DETERMINADO (NECESIDAD TRANSITORIA)-005,1,"S/. 3,722.00",18/02/2025,03/03/2025,e7eb38a8-5a22-4bae-af4d-caebd3855df1,2025-02-18 18:11:46.117560
UN (01) ESPECIALISTA EN INOCUIDAD ALIMENTARIA Y SALUD AMBIENTAL- REGIÓN AYACUCHO,MINISTERIO DE SALUD,AYACUCHO - AYACUCHO,D.LEG 1057 - DETERMINADO (NECESIDAD TRANSITORIA)-24,1,"S/. 8,000.00",18/02/2025,03/03/2025,55832705-9105-4944-b065-0f69cf879b79,2025-02-18 18:11:46.117560
ESPECIALISTA JUDICIAL DE JUZGADO,PODER JUDICIAL,AYACUCHO - AYACUCHO,D.LEG 1057 - DETERMINADO (NECESIDAD TRANSITORIA)-005,1,"S/. 2,972.00",18/02/2025,03/03/2025,8e4e85ef-db9a-4d6b-b1a8-438dd50faa78,2025-02-18 18:11:46.117560
ESPECIALISTA LEGAL,PODER JUDICIAL,AYACUCHO - AYACUCHO,D.LEG 1057 - DETERMINADO (NECESIDAD TRANSITORIA)-005,1,"S/. 2,972.00",18/02/2025,03/03/2025,5576a602-2879-4eca-936b-06abc40876c3,2025-02-18 18:11:46.117560
ASISTENTE JURISDICCIONAL DE JUZGADO,PODER JUDICIAL,AYACUCHO - AYACUCHO,D.LEG 1057 - DETERMINADO (SUPLENCIA)-007,1,"S/. 2,572.00",18/02/2025,03/03/2025,145236f9-2544-417d-ad29-ca04b1425b46,2025-02-18 18:11:46.117560
UNIDAD DE TESORERIA.,MUNICIPALIDAD DISTRITAL DE CARMEN ALTO,AYACUCHO - CARMEN ALTO,D.LEG 1057 - DETERMINADO (NECESIDAD TRANSITORIA)-001,1,"S/. 2,400.00",18/02/2025,03/03/2025,4ed1486b-617d-44b0-8388-7f1d6ff97dde,2025-02-18 18:11:46.117560
SUB GERENTE DE DESARROLLO ECONOMICO LOCAL Y MEDIO AMBIENTE.,MUNICIPALIDAD DISTRITAL DE CARMEN ALTO,AYACUCHO - CARMEN ALTO,D.LEG 1057 - DETERMINADO (NECESIDAD TRANSITORIA)-001,1,"S/. 2,800.00",18/02/2025,03/03/2025,3e79d161-0ba0-47db-99db-420a07193115,2025-02-18 18:11:46.117560
RESPONSABLE DE DIVISION DE DEFENSA CIVIL Y GESTION DE RIESGOS DE DESASTRES.,MUNICIPALIDAD DISTRITAL DE CARMEN ALTO,AYACUCHO - CARMEN ALTO,D.LEG 1057 - DETERMINADO (NECESIDAD TRANSITORIA)-001,1,"S/. 2,200.00",18/02/2025,03/03/2025,47d93da7-0f24-4b1a-9031-7e8384458e50,2025-02-18 18:11:46.117560
"JEFE DE LA OFICINA DE PLANIFICACIÒN, PRESUPUESTO Y RACIONALIZACIÒN.",MUNICIPALIDAD DISTRITAL DE CARMEN ALTO,AYACUCHO - CARMEN ALTO,D.LEG 1057 - DETERMINADO (NECESIDAD TRANSITORIA)-001,1,"S/. 2,600.00",18/02/2025,03/03/2025,bc7e875b-8aee-4155-a905-1167d8d3d3ab,2025-02-18 18:11:46.117560
JEFE DE LA OFICINA DE ASESORÍA JURÍDICA.,MUNICIPALIDAD DISTRITAL DE CARMEN ALTO,AYACUCHO - CARMEN ALTO,D.LEG 1057 - DETERMINADO (NECESIDAD TRANSITORIA)-001,1,"S/. 2,600.00",18/02/2025,03/03/2025,56a9c1be-267c-4e74-baf1-8fe77d0e8c1e,2025-02-18 18:11:46.117560
JEFE DE LA DIVISIÓN DE SUPERVISION Y LIQUIDACION DE OBRAS.,MUNICIPALIDAD DISTRITAL DE CARMEN ALTO,AYACUCHO - CARMEN ALTO,D.LEG 1057 - DETERMINADO (NECESIDAD TRANSITORIA)-001,1,"S/. 2,200.00",18/02/2025,03/03/2025,c5b8fbc5-ab5d-40de-961e-88d1b5d8d7c2,2025-02-18 18:11:46.117560
JEFE DE LA DIVISIÓN DE CATASTRO Y DESARROLLO URBANO.,MUNICIPALIDAD DISTRITAL DE CARMEN ALTO,AYACUCHO - CARMEN ALTO,D.LEG 1057 - DETERMINADO (NECESIDAD TRANSITORIA)-001,1,"S/. 2,200.00",18/02/2025,03/03/2025,07a9df0b-b576-450c-be1c-f4e59a296c9a,2025-02-18 18:11:46.117560
ESPECIALISTA EN CONTRATACIONES Y ADQUISICIONES.,MUNICIPALIDAD DISTRITAL DE CARMEN ALTO,AYACUCHO - CARMEN ALTO,D.LEG 1057 - DETERMINADO (NECESIDAD TRANSITORIA)-001,1,"S/. 2,200.00",18/02/2025,03/03/2025,49ee947f-2606-4d93-95a6-7c2f7c1e0766,2025-02-18 18:11:46.117560
TECNICOS DEPORTIVO CAS DE NÚCLEO DE LA INICIATIVA PEDAGOGICA WIÑAQ,UNIDAD EJECUTORA EDUCACION HUANTA,AYACUCHO - HUANTA,D.LEG 1057 - DETERMINADO (NECESIDAD TRANSITORIA)-010,2,"S/. 3,364.19",18/02/2025,03/03/2025,43cbf150-876f-4707-814b-8177ae08d1ee,2025-02-18 18:11:46.117560
RESPONSABLE DE BIENESTAR SOCIAL DE CRFA.,UNIDAD EJECUTORA EDUCACION HUANTA,AYACUCHO - HUANTA,D.LEG 1057 - DETERMINADO (NECESIDAD TRANSITORIA)-016,1,"S/. 2,764.19",18/02/2025,03/03/2025,ac5592a9-229f-44a4-92a0-6708dd14f9b9,2025-02-18 18:11:46.117560
PSICÓLOGOS (AS) – JEC:,UNIDAD EJECUTORA EDUCACION HUANTA,AYACUCHO - HUANTA,D.LEG 1057 - DETERMINADO (NECESIDAD TRANSITORIA)-023,11,"S/. 2,764.19",18/02/2025,03/03/2025,8033a324-f542-4c70-9fbd-6642c9c77254,2025-02-18 18:11:46.117560
"PROFESIONALES EN TECNOLOGIA MEDICA CON MENCION EN TERAPIA FISICA, OCUPACIONAL O DE LENGUAJE PARA CEBE",UNIDAD EJECUTORA EDUCACION HUANTA,AYACUCHO - HUANTA,D.LEG 1057 - DETERMINADO (NECESIDAD TRANSITORIA)-022,2,"S/. 2,964.19",18/02/2025,03/03/2025,ea65180d-4020-4df6-b8a7-0b9f7fcffe34,2025-02-18 18:11:46.117560
PROFESIONAL II PARA EQUIPO DE ITINERANTE DE CONVIVENCIA ESCOLAR,UNIDAD EJECUTORA EDUCACION HUANTA,AYACUCHO - HUANTA,D.LEG 1057 - DETERMINADO (NECESIDAD TRANSITORIA)-012,1,"S/. 3,064.19",18/02/2025,03/03/2025,013ca9c3-be6e-4c16-85ad-eebb56f7320c,2025-02-18 18:11:46.117560
PROFESIONAL I PARA EQUIPO DE ITINERANTE DE CONVIVENCIA ESCOLAR,UNIDAD EJECUTORA EDUCACION HUANTA,AYACUCHO - HUANTA,D.LEG 1057 - DETERMINADO (NECESIDAD TRANSITORIA)-011,1,"S/. 3,064.19",18/02/2025,03/03/2025,f2d15a36-38fe-49cf-bf12-b0eefcaaf424,2025-02-18 18:11:46.117560
PROFESIONAL EN TECNOLOGIA MEDICA CON MENCION EN TERAPIA FISICA PARA LOS PROGRAMAS DE INTERVENCION TEMPRANA,UNIDAD EJECUTORA EDUCACION HUANTA,AYACUCHO - HUANTA,D.LEG 1057 - DETERMINADO (NECESIDAD TRANSITORIA)-021,1,"S/. 2,964.19",18/02/2025,03/03/2025,9b776ac2-a5e1-4027-94a3-4337d6f3694b,2025-02-18 18:11:46.117560
PERSONAL DE MANTENIMIENTO - JEC,UNIDAD EJECUTORA EDUCACION HUANTA,AYACUCHO - HUANTA,D.LEG 1057 - DETERMINADO (NECESIDAD TRANSITORIA)-025,5,"S/. 1,414.19",18/02/2025,03/03/2025,6e4940e9-6745-40b3-adee-af6da9865858,2025-02-18 18:11:46.117560
PERSONAL DE MANTENIMIENTO - CRFA,UNIDAD EJECUTORA EDUCACION HUANTA,AYACUCHO - HUANTA,D.LEG 1057 - DETERMINADO (NECESIDAD TRANSITORIA)-018,1,"S/. 1,289.19",18/02/2025,03/03/2025,554847d7-d73b-4684-8ad6-28be3104a7d4,2025-02-18 18:11:46.117560
PERSONAL DE LIMPIEZA Y MANTENIMIENTO,UNIDAD EJECUTORA EDUCACION HUANTA,AYACUCHO - HUANTA,D.LEG 1057 - DETERMINADO (NECESIDAD TRANSITORIA)-019,2,"S/. 1,414.19",18/02/2025,03/03/2025,107186fc-4944-413d-a2f3-a243906ca59a,2025-02-18 18:11:46.117560
PERSONAL DE COCINA DE CRFA,UNIDAD EJECUTORA EDUCACION HUANTA,AYACUCHO - HUANTA,D.LEG 1057 - DETERMINADO (NECESIDAD TRANSITORIA)-017,1,"S/. 1,414.19",18/02/2025,03/03/2025,fd96c0af-5add-45a3-aab9-d7575e393a2e,2025-02-18 18:11:46.117560
EDUCADOR (A) MUSICAL ESPECIALIZADO DE ORQUESTANDO EBE,UNIDAD EJECUTORA EDUCACION HUANTA,AYACUCHO - HUANTA,D.LEG 1057 - DETERMINADO (NECESIDAD TRANSITORIA)-020,1,"S/. 2,464.19",18/02/2025,03/03/2025,0367f564-7474-4081-9944-36c659eef3f2,2025-02-18 18:11:46.117560
COORDINARES (AS) DE INNOVACIÓN Y SOPORTE TECNOLOGICO - JEC,UNIDAD EJECUTORA EDUCACION HUANTA,AYACUCHO - HUANTA,D.LEG 1057 - DETERMINADO (NECESIDAD TRANSITORIA)-024,10,"S/. 1,614.19",18/02/2025,03/03/2025,e3b94643-d2db-45a8-a614-88bfb446956d,2025-02-18 18:11:46.117560
COORDINADORES (AS) DE REDES EDUCATIVAS RURALES,UNIDAD EJECUTORA EDUCACION HUANTA,AYACUCHO - HUANTA,D.LEG 1057 - DETERMINADO (NECESIDAD TRANSITORIA)-013,4,"S/. 4,764.19",18/02/2025,03/03/2025,5cee1eac-74c8-469d-82de-4464111bc86e,2025-02-18 18:11:46.117560
COORDINADORES (AS) ADMINISTRATIVO (A) DE REDES EDUCATIVAS RURALES,UNIDAD EJECUTORA EDUCACION HUANTA,AYACUCHO - HUANTA,D.LEG 1057 - DETERMINADO (NECESIDAD TRANSITORIA)-014,4,"S/. 2,264.19",18/02/2025,03/03/2025,2ad84349-1ceb-4eda-a691-1eaaa8253bd9,2025-02-18 18:11:46.117560
COORDINADOR (A) DE CRFA,UNIDAD EJECUTORA EDUCACION HUANTA,AYACUCHO - HUANTA,D.LEG 1057 - DETERMINADO (NECESIDAD TRANSITORIA)-015,1,"S/. 3,464.19",18/02/2025,03/03/2025,2c39735b-0692-4268-8627-5eea977d421f,2025-02-18 18:11:46.117560
COORDINADOR DE MÓDULO,DEFENSORIA DEL PUEBLO,AYACUCHO - HUANTA,D.LEG 1057 - DETERMINADO (SUPLENCIA)-02,1,"S/. 6,000.00",18/02/2025,03/03/2025,87c14392-208f-4f8d-936d-efd868655f77,2025-02-18 18:11:46.117560
APOYO Y COORDINACION EN ACTIVIDADES ADMINISTRATIVAS,PODER JUDICIAL,AYACUCHO - PUQUIO,D.LEG 1057 - DETERMINADO (NECESIDAD TRANSITORIA)-006,1,"S/. 2,120.00",18/02/2025,03/03/2025,33d0d8b9-5891-4295-b8ad-b9f9a6bf2bbe,2025-02-18 18:11:46.117560
SUB GERENCIA DE DESARROLLO ECONÓMICO MEDIO AMBIENTE Y TURISMO.,MUNICIPALIDAD DISTRITAL DE UCHURACCAY,AYACUCHO - UCHURACCAY,D.LEG 1057 - DETERMINADO (NECESIDAD TRANSITORIA)-01,1,"S/. 2,400.00",18/02/2025,03/03/2025,60023f3a-f489-4bf3-95f6-b22035af3651,2025-02-18 18:11:46.117560
TÉCNICO ADMINISTRATIVO - RACIONALIZACIÓN,UNIDAD DE GESTION EDUCATIVA LOCAL DE HUAMANGA,AYACUCHO - AYACUCHO,D.LEG 1057 - DETERMINADO (NECESIDAD TRANSITORIA)-022,1,"S/. 2,264.19",17/02/2025,28/02/2025,4d9d651a-9630-4387-ba9f-5d3a599e0bca,2025-02-18 18:11:46.117560
CONTADOR,HOSPITAL REGIONAL DE AYACUCHO,AYACUCHO - ANDRES AVELINO CACERES DORREGARAY,D.LEG 1057 - DETERMINADO (NECESIDAD TRANSITORIA)-001,1,"S/. 1,800.00",17/02/2025,28/02/2025,ab167873-e9c6-4899-ba8d-ff8ed62cd950,2025-02-18 18:11:46.117560
ESPECIALISTA EN SIAF - FINANZAS,UNIDAD DE GESTION EDUCATIVA LOCAL DE HUAMANGA,AYACUCHO - AYACUCHO,D.LEG 1057 - DETERMINADO (NECESIDAD TRANSITORIA)-022,1,"S/. 2,864.19",17/02/2025,28/02/2025,ee142a04-3551-4e18-ad95-55a14894fca8,2025-02-18 18:11:46.117560
ESPECIALISTA DE CALIDAD DEL SERVICIO EDUCATIVO SUPERIOR TECNOLÓGICO PARA LA DRE AYACUCHO,DIRECCION REGIONAL DE EDUCACION AYACUCHO,AYACUCHO - AYACUCHO,D.LEG 1057 - DETERMINADO (NECESIDAD TRANSITORIA)-001,1,"S/. 3,164.00",17/02/2025,28/02/2025,ad4af748-4d6e-4f7e-9690-8dee4fc44499,2025-02-18 18:11:46.117560
ESPECIALISTA EN TESORERÌA,ZONA REGISTRAL N° XIV-SEDE AYACUCHO,AYACUCHO - AYACUCHO,D.LEG 1057 - DETERMINADO (SUPLENCIA)-006,1,"S/. 5,000.00",17/02/2025,28/02/2025,2181ef5e-3af1-4eaf-b410-5445d299a06a,2025-02-18 18:11:46.117560
DEFENSOR PUBLICO EN EL NUEVO CODIGO PROCESAL PENAL,MINISTERIO DE JUSTICIA Y DERECHOS HUMANOS,AYACUCHO - AYACUCHO,D.LEG 1057 - DETERMINADO (SUPLENCIA)-170,1,"S/. 5,264.19",17/02/2025,28/02/2025,bef5a039-aef2-4759-a424-aae82c27427d,2025-02-18 18:11:46.117560
CONTRATACIÓN ADMINISTRATIVA DE SERVICIOS DE UN(A) AUXILIAR MONITOR DE RESIDENCIA PARA EL COLEGIO DE ALTO RENDIMIENTO DE LA REGIÓN AYACUCHO - SUPLENCIA TEMPORAL (003894),MINISTERIO DE EDUCACION,AYACUCHO - AYACUCHO,D.LEG 1057 - DETERMINADO (SUPLENCIA)-0202,1,"S/. 2,500.00",17/02/2025,28/02/2025,84bdafba-30ad-455b-a6e3-09bc5a490c5f,2025-02-18 18:11:46.117560
DEFENSOR PÚBLICO DE DEFENSA DE VÍCTIMAS SNEJ,MINISTERIO DE JUSTICIA Y DERECHOS HUMANOS,AYACUCHO - VINCHOS,D.LEG 1057 - DETERMINADO (SUPLENCIA)-161,1,"S/. 7,264.19",17/02/2025,28/02/2025,3569e354-fbd1-4f2d-93fa-0e8893039fa9,2025-02-18 18:11:46.117560
PSICOLOGOS(AS),UNID EJEC EDUCACION CENTRO AYACUCHO,AYACUCHO - CANGALLO,D.LEG 1057 - DETERMINADO (NECESIDAD TRANSITORIA)-8,5,"S/. 2,764.19",17/02/2025,28/02/2025,8bb247cf-5a73-4f65-92ec-2c81b18ef886,2025-02-18 18:11:46.117560
