posicion,empresa,ubicacion,num_conv,n_vac,salario,fecha_inicio,fecha_fin,id_uuid,fechaActualizacion
GESTOR LOCAL,PROGRAMA NACIONAL DE APOYO DIRECTO A LOS MAS POBRES,CAJAMARCA - CAJAMARCA,D.LEG 1057 - DETERMINADO (NECESIDAD TRANSITORIA)-051,1,"S/. 2,000.00",24/02/2025,07/03/2025,915719f8-4333-454d-b071-89ac3d615ce1,2025-02-26 02:31:58.265691
GESTORES DE DESARROLLO SOCIAL,PROGRAMA NACIONAL DE APOYO DIRECTO A LOS MAS POBRES,CAJAMARCA - CAJAMARCA,D.LEG 1057 - DETERMINADO (NECESIDAD TRANSITORIA)-46,2,"S/. 3,000.00",24/02/2025,07/03/2025,21e86072-7897-4ef0-ab1f-babfeab1f635,2025-02-26 02:31:58.265691
RESPONSABLE DE ESTUDIOS Y PROYECTOS,MUNICIPALIDAD DISTRITAL DE TONGOD,CAJAMARCA - TONGOD,D.LEG 1057 - DETERMINADO (NECESIDAD TRANSITORIA)-1,1,"S/. 2,500.00",21/02/2025,06/03/2025,2e2bb9ee-7693-47f2-a09d-f88f5030ea1f,2025-02-26 02:31:58.265691
RESPONSABLE DEL PROGRAMA VASO DE LECHE,MUNICIPALIDAD DISTRITAL DE TONGOD,CAJAMARCA - TONGOD,D.LEG 1057 - DETERMINADO (NECESIDAD TRANSITORIA)-1,1,"S/. 1,200.00",21/02/2025,06/03/2025,07910a7c-12f3-444d-a5f4-9bfae2a1cf35,2025-02-26 02:31:58.265691
TRABAJADOR DE SERVICIO,UNIDAD DE GESTION EDUCATIVA LOCAL DE LA PROVINCIA DE SAN MIGUEL - UGEL SAN MIGUEL,CAJAMARCA - SAN MIGUEL,276-1,1,"S/. 2,500.00",21/02/2025,06/03/2025,b86b419d-ff2d-493e-aa75-2c2c5d9e0757,2025-02-26 02:31:58.265691
ESPECIALISTA DE ALMACEN,MUNICIPALIDAD DISTRITAL DE HUARANGO,CAJAMARCA - HUARANGO,D.LEG 1057 - DETERMINADO (NECESIDAD TRANSITORIA)-001,1,"S/. 2,500.00",21/02/2025,06/03/2025,9c855085-b0fa-425b-8282-53065f62e6ce,2025-02-26 02:31:58.265691
ESPECIALISTA DEMUNA - I,MUNICIPALIDAD DISTRITAL DE HUARANGO,CAJAMARCA - HUARANGO,D.LEG 1057 - DETERMINADO (NECESIDAD TRANSITORIA)-001,1,"S/. 2,700.00",21/02/2025,06/03/2025,f7ff75e0-e19e-4334-af20-99e69978b654,2025-02-26 02:31:58.265691
INGENIERO AGRONOMO I,MUNICIPALIDAD DISTRITAL DE HUARANGO,CAJAMARCA - HUARANGO,D.LEG 1057 - DETERMINADO (NECESIDAD TRANSITORIA)-001,1,"S/. 2,500.00",21/02/2025,06/03/2025,ce9c9273-bd3e-4db8-8312-10a809c1443d,2025-02-26 02:31:58.265691
JEFE DE LA SUB UNIDAD DE IMAGEN Y RELACIONES PUBLICAS,MUNICIPALIDAD DISTRITAL DE HUARANGO,CAJAMARCA - HUARANGO,D.LEG 1057 - DETERMINADO (NECESIDAD TRANSITORIA)-001,1,"S/. 2,500.00",21/02/2025,06/03/2025,67fd8959-9f10-4b47-84e9-53c59c38c806,2025-02-26 02:31:58.265691
JEFE DE LA SUB UNIDAD TECNICA DEL AGUA Y CONSERVACION MUNICIPAL,MUNICIPALIDAD DISTRITAL DE HUARANGO,CAJAMARCA - HUARANGO,D.LEG 1057 - DETERMINADO (NECESIDAD TRANSITORIA)-001,1,"S/. 2,700.00",21/02/2025,06/03/2025,ab9de5da-e725-400f-8a7d-5bdd5c7bba2a,2025-02-26 02:31:58.265691
JEFE DE LA SUBUNIDAD DE CATASTRO Y CONTROL URBANO,MUNICIPALIDAD DISTRITAL DE HUARANGO,CAJAMARCA - HUARANGO,D.LEG 1057 - DETERMINADO (NECESIDAD TRANSITORIA)-001,1,"S/. 2,700.00",21/02/2025,06/03/2025,86ed0e84-1062-4552-9076-b63e1a711846,2025-02-26 02:31:58.265691
JEFE DE LA SUBUNIDAD DE COMERCIALIZACION Y VIGILANCIA SANITARIA,MUNICIPALIDAD DISTRITAL DE HUARANGO,CAJAMARCA - HUARANGO,D.LEG 1057 - DETERMINADO (NECESIDAD TRANSITORIA)-001,1,"S/. 2,700.00",21/02/2025,06/03/2025,3c75cf12-1caa-40f0-a1d9-cff2db8ce470,2025-02-26 02:31:58.265691
JEFE DE LA SUBUNIDAD DE GESTION DEL RIESGO DE DESASTRES,MUNICIPALIDAD DISTRITAL DE HUARANGO,CAJAMARCA - HUARANGO,D.LEG 1057 - DETERMINADO (NECESIDAD TRANSITORIA)-001,1,"S/. 2,700.00",21/02/2025,06/03/2025,d2dc1934-5014-415a-a22a-557b3f4bb657,2025-02-26 02:31:58.265691
JEFE DE LA SUBUNIDAD DE SUPERVISIÓN Y LIQUIDACIONES,MUNICIPALIDAD DISTRITAL DE HUARANGO,CAJAMARCA - HUARANGO,D.LEG 1057 - DETERMINADO (NECESIDAD TRANSITORIA)-001,1,"S/. 2,700.00",21/02/2025,06/03/2025,a2220656-7eff-4c88-905c-e356f539c435,2025-02-26 02:31:58.265691
JEFE DE LA SUBUNIDAD EJECUTORA DE INVERSIONES,MUNICIPALIDAD DISTRITAL DE HUARANGO,CAJAMARCA - HUARANGO,D.LEG 1057 - DETERMINADO (NECESIDAD TRANSITORIA)-001,1,"S/. 2,700.00",21/02/2025,06/03/2025,2bc22bea-839d-45cd-a063-fe1080f3a9e4,2025-02-26 02:31:58.265691
JEFE DE LA SUBUNIDAD FORMULADORA DE INVERSIONES,MUNICIPALIDAD DISTRITAL DE HUARANGO,CAJAMARCA - HUARANGO,D.LEG 1057 - DETERMINADO (NECESIDAD TRANSITORIA)-001,1,"S/. 2,700.00",21/02/2025,06/03/2025,5ce7aeed-32a6-4306-9a31-744d81f3e549,2025-02-26 02:31:58.265691
RESPONSABLE DE LA OMAPED,MUNICIPALIDAD DISTRITAL DE HUARANGO,CAJAMARCA - HUARANGO,D.LEG 1057 - DETERMINADO (NECESIDAD TRANSITORIA)-001,1,"S/. 2,000.00",21/02/2025,06/03/2025,bf3c61b0-b871-4b0a-9cb0-27d28a891138,2025-02-26 02:31:58.265691
RESPONSABLE DE LA UNIDAD LOCAL DE EMPADRONAMIENTO,MUNICIPALIDAD DISTRITAL DE HUARANGO,CAJAMARCA - HUARANGO,D.LEG 1057 - DETERMINADO (NECESIDAD TRANSITORIA)-001,1,"S/. 2,500.00",21/02/2025,06/03/2025,cdd0ebde-b924-4a47-be82-ee12d8345f4d,2025-02-26 02:31:58.265691
SUBGERENTE DE ADMINISTRACION TRIBUTARIA,MUNICIPALIDAD DISTRITAL DE HUARANGO,CAJAMARCA - HUARANGO,D.LEG 1057 - DETERMINADO (NECESIDAD TRANSITORIA)-001,1,"S/. 3,000.00",21/02/2025,06/03/2025,5a601165-6c2e-4e5c-ab22-b24ba6b333a0,2025-02-26 02:31:58.265691
SUBGERENTE DE CONTABILIDAD,MUNICIPALIDAD DISTRITAL DE HUARANGO,CAJAMARCA - HUARANGO,D.LEG 1057 - DETERMINADO (NECESIDAD TRANSITORIA)-001,1,"S/. 3,000.00",21/02/2025,06/03/2025,81ce57a3-159f-42db-9b49-a42d9ca2a01a,2025-02-26 02:31:58.265691
SUBGERENTE DE CONTROL PATRIMONIAL,MUNICIPALIDAD DISTRITAL DE HUARANGO,CAJAMARCA - HUARANGO,D.LEG 1057 - DETERMINADO (NECESIDAD TRANSITORIA)-001,1,"S/. 3,000.00",21/02/2025,06/03/2025,f50b26f0-fa86-46bb-8283-6b4e36501ae6,2025-02-26 02:31:58.265691
SUBGERENTE DE GESTION AMBIELTAL Y RECURSOS NATURALES,MUNICIPALIDAD DISTRITAL DE HUARANGO,CAJAMARCA - HUARANGO,D.LEG 1057 - DETERMINADO (NECESIDAD TRANSITORIA)-001,1,"S/. 3,000.00",21/02/2025,06/03/2025,b3202be5-ce3d-44c5-b73e-e2c657a38710,2025-02-26 02:31:58.265691
SUBGERENTE DE LOGISTICA Y SERVICIOS GENERALES,MUNICIPALIDAD DISTRITAL DE HUARANGO,CAJAMARCA - HUARANGO,D.LEG 1057 - DETERMINADO (NECESIDAD TRANSITORIA)-001,1,"S/. 3,000.00",21/02/2025,06/03/2025,a943c1c5-a86c-42be-85b8-2edc7d659d81,2025-02-26 02:31:58.265691
"SUBGERENTE DE PLANEAMIENTO URBANO, ESTUDIOS Y PROYECTOS",MUNICIPALIDAD DISTRITAL DE HUARANGO,CAJAMARCA - HUARANGO,D.LEG 1057 - DETERMINADO (NECESIDAD TRANSITORIA)-001,1,"S/. 3,000.00",21/02/2025,06/03/2025,d42ec4d1-f174-475a-bb43-a196016f635e,2025-02-26 02:31:58.265691
SUBGERENTE DE PROGRAMAS SOCIALES,MUNICIPALIDAD DISTRITAL DE HUARANGO,CAJAMARCA - HUARANGO,D.LEG 1057 - DETERMINADO (NECESIDAD TRANSITORIA)-001,1,"S/. 3,000.00",21/02/2025,06/03/2025,73048893-b300-4dc7-9581-56d3e7a63554,2025-02-26 02:31:58.265691
SUBGERENTE DE TECNOLOGIAS DE LA INFORMACION Y COMUNICACION,MUNICIPALIDAD DISTRITAL DE HUARANGO,CAJAMARCA - HUARANGO,D.LEG 1057 - DETERMINADO (NECESIDAD TRANSITORIA)-001,1,"S/. 3,000.00",21/02/2025,06/03/2025,1e0cb280-6baf-45d3-bfea-dd74d2685034,2025-02-26 02:31:58.265691
SUBGERENTE DE TESORERIA,MUNICIPALIDAD DISTRITAL DE HUARANGO,CAJAMARCA - HUARANGO,D.LEG 1057 - DETERMINADO (NECESIDAD TRANSITORIA)-001,1,"S/. 3,000.00",21/02/2025,06/03/2025,7347e61e-ce88-4033-8885-80e66830e6ae,2025-02-26 02:31:58.265691
TECNICO COTIZADOR I,MUNICIPALIDAD DISTRITAL DE HUARANGO,CAJAMARCA - HUARANGO,D.LEG 1057 - DETERMINADO (NECESIDAD TRANSITORIA)-001,1,"S/. 2,300.00",21/02/2025,06/03/2025,2a20fab6-e11f-4a98-85bd-4710bc7628c2,2025-02-26 02:31:58.265691
ESPECIALISTA ALIMENTARIO,PROGRAMA NACIONAL DE ALIMENTACIÓN ESCOLAR QALI WARMA,CAJAMARCA - JAEN,D.LEG 1057 - DETERMINADO (SUPLENCIA)-010,1,"S/. 3,200.00",21/02/2025,06/03/2025,a87fcf49-e48d-448a-a878-af18803e052c,2025-02-26 02:31:58.265691
COORDINADOR DE INNOVACIÓN Y SOPORTE TECNOLÓGICO,UNIDAD DE GESTION EDUCATIVA LOCAL CELENDIN,CAJAMARCA - CELENDIN,D.LEG 1057 - DETERMINADO (NECESIDAD TRANSITORIA)-3,8,"S/. 1,614.19",21/02/2025,06/03/2025,9179e11a-0491-4cb3-a96a-a2e33597b4f0,2025-02-26 02:31:58.265691
ESPECIALISTA DE CONVIVENCIA ESCOLAR DE LA UGEL,UNIDAD DE GESTION EDUCATIVA LOCAL CELENDIN,CAJAMARCA - CELENDIN,D.LEG 1057 - DETERMINADO (NECESIDAD TRANSITORIA)-3,1,"S/. 3,764.19",21/02/2025,06/03/2025,169af9a3-65f5-4ec8-9c9e-0a65acd9abf1,2025-02-26 02:31:58.265691
PROFESIONAL III PARA EQUIPO ITINERANTE DE CONVIVENCIA ESCOLAR,UNIDAD DE GESTION EDUCATIVA LOCAL CELENDIN,CAJAMARCA - CELENDIN,D.LEG 1057 - DETERMINADO (NECESIDAD TRANSITORIA)-3,1,"S/. 3,064.19",21/02/2025,06/03/2025,a9dcba59-2438-4c6f-aebf-356a6b2ad031,2025-02-26 02:31:58.265691
PERSONAL DE VIGILANCIA,UNIDAD DE GESTION EDUCATIVA LOCAL CELENDIN,CAJAMARCA - CELENDIN,D.LEG 1057 - DETERMINADO (NECESIDAD TRANSITORIA)-3,3,"S/. 1,414.19",21/02/2025,06/03/2025,3b6053a9-884c-4eb4-b5c9-9d6bdfdc34a2,2025-02-26 02:31:58.265691
PERSONAL DE LIMPIEZA Y MANTENIMIENTO,UNIDAD DE GESTION EDUCATIVA LOCAL CELENDIN,CAJAMARCA - CELENDIN,D.LEG 1057 - DETERMINADO (NECESIDAD TRANSITORIA)-3,2,"S/. 1,414.19",21/02/2025,06/03/2025,b02ae9c2-1fd1-47e9-a630-41686b1175f4,2025-02-26 02:31:58.265691
PERSONAL DE MANTENIMIENTO,UNIDAD DE GESTION EDUCATIVA LOCAL CELENDIN,CAJAMARCA - CELENDIN,D.LEG 1057 - DETERMINADO (NECESIDAD TRANSITORIA)-3,8,"S/. 1,414.19",21/02/2025,06/03/2025,f1a18078-6b83-4843-aef8-232c1565c83a,2025-02-26 02:31:58.265691
PROFESIONAL EN PSICOLOGÍA,UNIDAD DE GESTION EDUCATIVA LOCAL CELENDIN,CAJAMARCA - CELENDIN,D.LEG 1057 - DETERMINADO (NECESIDAD TRANSITORIA)-3,1,"S/. 2,764.19",21/02/2025,06/03/2025,0d77710d-5e73-4a26-ac4f-081decbc70d6,2025-02-26 02:31:58.265691
"PROFESIONAL EN TECNOLOGÍA MÉDICA CON MENCIÓN EN TERAPIA FÍSICA, OCUPACIONAL O DE LENGUAJE PARA CEBE",UNIDAD DE GESTION EDUCATIVA LOCAL CELENDIN,CAJAMARCA - CELENDIN,D.LEG 1057 - DETERMINADO (NECESIDAD TRANSITORIA)-1,1,"S/. 2,964.19",21/02/2025,06/03/2025,8217588c-39a5-42d4-966e-71993709ee81,2025-02-26 02:31:58.265691
PSICÓLOGO (A),UNIDAD DE GESTION EDUCATIVA LOCAL CELENDIN,CAJAMARCA - CELENDIN,D.LEG 1057 - DETERMINADO (NECESIDAD TRANSITORIA)-3,3,"S/. 2,764.19",21/02/2025,06/03/2025,92b09868-b94f-4580-97a8-5c013682db7d,2025-02-26 02:31:58.265691
ESPECIALISTA ALIMENTARIO,PROGRAMA NACIONAL DE ALIMENTACIÓN ESCOLAR QALI WARMA,CAJAMARCA - CAJAMARCA,D.LEG 1057 - DETERMINADO (SUPLENCIA)-009,1,"S/. 3,200.00",21/02/2025,06/03/2025,93d015dd-ab93-450f-b301-e8d9f97a6c7b,2025-02-26 02:31:58.265691
JEFE DE LA UNIDAD DE SUPERVISION Y LIQUIDACIONES,MUNICIPALIDAD DISTRITAL DE TONGOD,CAJAMARCA - TONGOD,D.LEG 1057 - DETERMINADO (NECESIDAD TRANSITORIA)-1,1,"S/. 2,500.00",21/02/2025,06/03/2025,80f6743d-288b-4b64-be7a-3254ce40fe41,2025-02-26 02:31:58.265691
ASISTENTE  DE LA UNIDAD LOCAL DE EMPADRONAMIENTO - ULE,MUNICIPALIDAD DISTRITAL DE TONGOD,CAJAMARCA - TONGOD,D.LEG 1057 - DETERMINADO (NECESIDAD TRANSITORIA)-1,1,"S/. 1,300.00",21/02/2025,06/03/2025,14e010ad-6afe-48ea-bdd1-7c29db7add4e,2025-02-26 02:31:58.265691
JEFE DE LA UNIDAD DE RECURSOS HUMANOS,MUNICIPALIDAD DISTRITAL DE TONGOD,CAJAMARCA - TONGOD,D.LEG 1057 - DETERMINADO (NECESIDAD TRANSITORIA)-1,1,"S/. 2,000.00",21/02/2025,06/03/2025,5a29b06b-58f3-440c-909d-fe7878490f82,2025-02-26 02:31:58.265691
COORDINADOR (A) DE INNOVACIÓN Y SOPORTE TECNOLÓGICO,UNIDAD DE GESTION EDUCATIVA LOCAL SAN PABLO,CAJAMARCA - SAN PABLO,D.LEG 1057 - DETERMINADO (NECESIDAD TRANSITORIA)-02,2,"S/. 1,614.19",20/02/2025,05/03/2025,25f92d5e-d0b9-46cc-bee4-7e5fce2d46d2,2025-02-26 02:31:58.265691
ESPECIALISTA DE CONVIVENCIA ESCOLAR DE LA UGEL,UNIDAD DE GESTION EDUCATIVA LOCAL SAN PABLO,CAJAMARCA - SAN PABLO,D.LEG 1057 - DETERMINADO (NECESIDAD TRANSITORIA)-02,1,"S/. 3,764.19",20/02/2025,05/03/2025,4db18b5c-60e9-4978-9a17-7f5e22b1213a,2025-02-26 02:31:58.265691
PERSONAL DE MANTENIMIENTO,UNIDAD DE GESTION EDUCATIVA LOCAL SAN PABLO,CAJAMARCA - SAN PABLO,D.LEG 1057 - DETERMINADO (NECESIDAD TRANSITORIA)-02,3,"S/. 1,414.19",20/02/2025,05/03/2025,5cadcf8c-ccf8-44be-b073-17b23e9a9af8,2025-02-26 02:31:58.265691
PERSONAL DE VIGILANCIA,UNIDAD DE GESTION EDUCATIVA LOCAL SAN PABLO,CAJAMARCA - SAN PABLO,D.LEG 1057 - DETERMINADO (NECESIDAD TRANSITORIA)-02,3,"S/. 1,414.19",20/02/2025,05/03/2025,9943af59-750c-4a32-9a4e-0113c6ec2cae,2025-02-26 02:31:58.265691
PROFESIONAL III PARA EQUIPO ITINERANTE DE CONVIVENCIA ESCOLAR,UNIDAD DE GESTION EDUCATIVA LOCAL SAN PABLO,CAJAMARCA - SAN PABLO,D.LEG 1057 - DETERMINADO (NECESIDAD TRANSITORIA)-02,1,"S/. 3,064.19",20/02/2025,05/03/2025,0b70c4e3-358f-43f5-8996-975385797fab,2025-02-26 02:31:58.265691
"PROFESIONAL EN TECNOLOGÍA MÉDICA CON MENCIÓN EN TERAPIA FÍSICA, OCUPACIONAL O DE LENGUAJE PARA CEBE",UNIDAD DE GESTION EDUCATIVA LOCAL SAN PABLO,CAJAMARCA - SAN PABLO,D.LEG 1057 - DETERMINADO (NECESIDAD TRANSITORIA)-02,1,"S/. 2,964.19",20/02/2025,05/03/2025,b055a3fa-93a3-4713-805a-c93ce3df601a,2025-02-26 02:31:58.265691
PSICÓLOGO (A),UNIDAD DE GESTION EDUCATIVA LOCAL SAN PABLO,CAJAMARCA - SAN PABLO,D.LEG 1057 - DETERMINADO (NECESIDAD TRANSITORIA)-02,2,"S/. 2,764.19",20/02/2025,05/03/2025,af97ddd6-76a9-4d42-b1d1-64c92074cfa2,2025-02-26 02:31:58.265691
ACOMPAÑANTE TECNICO PARA EL SERVICIO DE CUIDADO DIURNO,PROGRAMA NACIONAL CUNA MAS,CAJAMARCA - PEDRO GALVEZ,D.LEG 1057 - DETERMINADO (NECESIDAD TRANSITORIA)-120,1,"S/. 2,764.19",20/02/2025,05/03/2025,8c83b18c-39c9-4171-bb16-5255c0d9917c,2025-02-26 02:31:58.265691
SECRETARIA,UGEL LA UNIÓN,AREQUIPA - COTAHUASI,276-0002,1,"S/. 1,203.00",25/02/2025,10/03/2025,79a8d417-7d02-4c15-8dc2-35d05b8612fe,2025-02-26 02:31:58.265691
ASISTENTE ADMINISTRATIVO,DEFENSORIA DEL PUEBLO,AREQUIPA - AREQUIPA,728-01,1,"S/. 4,400.00",25/02/2025,10/03/2025,88ca2a23-dfbe-4442-a15a-9615822865ef,2025-02-26 02:31:58.265691
APOYO ADMINISTRATIVO,PODER JUDICIAL,AREQUIPA - AREQUIPA,D.LEG 1057 - DETERMINADO (SUPLENCIA)-003,1,"S/. 1,300.00",25/02/2025,10/03/2025,1f267d5d-5704-4450-a882-e8934c6b1e1c,2025-02-26 02:31:58.265691
APOYO ADMINISTRATIVO,PODER JUDICIAL,AREQUIPA - AREQUIPA,D.LEG 1057 - DETERMINADO (SUPLENCIA)-003,1,"S/. 1,720.00",25/02/2025,10/03/2025,d90b3f0b-a847-4c3c-92a2-8a8f78f4560b,2025-02-26 02:31:58.265691
APOYO EN LA DIGITACION Y ORDENAMIENTO,PODER JUDICIAL,AREQUIPA - AREQUIPA,D.LEG 1057 - DETERMINADO (SUPLENCIA)-003,1,"S/. 1,300.00",25/02/2025,10/03/2025,c19a3c7e-eea7-409d-9b49-20cce6f04bfd,2025-02-26 02:31:58.265691
APOYO EN LAS LABORES DE SOPORTE TECNICO,PODER JUDICIAL,AREQUIPA - AREQUIPA,D.LEG 1057 - DETERMINADO (SUPLENCIA)-003,1,"S/. 1,500.00",25/02/2025,10/03/2025,eb988d00-1127-4e81-98fc-742cf6635247,2025-02-26 02:31:58.265691
APOYO EN LOS ORGANOS JURISDICCIONALES (ASISTENCIA A LOS JUECES EN LAS ACTUACIONES Y DILIGENCIAS DEL JUZGADO),PODER JUDICIAL,AREQUIPA - AREQUIPA,D.LEG 1057 - DETERMINADO (SUPLENCIA)-003,1,"S/. 1,720.00",25/02/2025,10/03/2025,0070427b-0ce8-40c0-b6d6-f1849dad9c7d,2025-02-26 02:31:58.265691
ASISTENTE JUDICIAL,PODER JUDICIAL,AREQUIPA - AREQUIPA,D.LEG 1057 - DETERMINADO (SUPLENCIA)-003,1,"S/. 4,000.00",25/02/2025,10/03/2025,4a0face3-bab1-4c1c-bb04-acc410725208,2025-02-26 02:31:58.265691
ASISTENTE JUDICIAL - PENAL,PODER JUDICIAL,AREQUIPA - AREQUIPA,D.LEG 1057 - DETERMINADO (SUPLENCIA)-003,1,"S/. 3,470.00",25/02/2025,10/03/2025,25647ef6-edf9-4569-9cf7-3c8f1e76c469,2025-02-26 02:31:58.265691
ASISTENTE JUDICIAL - PROTECCIÓN,PODER JUDICIAL,AREQUIPA - AREQUIPA,D.LEG 1057 - DETERMINADO (SUPLENCIA)-003,1,"S/. 3,470.00",25/02/2025,10/03/2025,8a765959-59d5-4471-833c-299e82e2395c,2025-02-26 02:31:58.265691
AUXILIAR LEGAL,PODER JUDICIAL,AREQUIPA - AREQUIPA,D.LEG 1057 - DETERMINADO (SUPLENCIA)-003,1,"S/. 3,150.00",25/02/2025,10/03/2025,312b7d44-a9f8-4904-a252-3bc73cfa5f88,2025-02-26 02:31:58.265691
ESPECIALISTA JUDICIAL,PODER JUDICIAL,AREQUIPA - AREQUIPA,D.LEG 1057 - DETERMINADO (SUPLENCIA)-003,1,"S/. 4,750.00",25/02/2025,10/03/2025,2239e5f2-632e-45dd-83fb-0dae70fa2a4c,2025-02-26 02:31:58.265691
ESPECIALISTA JUDICIAL DE JUZGADO / ESPECIALISTA JUDICIAL DE AUDIENCIA,PODER JUDICIAL,AREQUIPA - AREQUIPA,D.LEG 1057 - DETERMINADO (SUPLENCIA)-003,3,"S/. 2,972.00",25/02/2025,10/03/2025,b65f2051-358b-49dc-8b31-7cd746155965,2025-02-26 02:31:58.265691
ESPECIALISTA JUDICIAL DE SALA,PODER JUDICIAL,AREQUIPA - AREQUIPA,D.LEG 1057 - DETERMINADO (SUPLENCIA)-003,1,"S/. 3,722.00",25/02/2025,10/03/2025,bddd7f88-1280-401b-a35a-0dd0e8fd4ff2,2025-02-26 02:31:58.265691
SECRETARIO JUDICIAL,PODER JUDICIAL,AREQUIPA - AREQUIPA,D.LEG 1057 - DETERMINADO (SUPLENCIA)-003,1,"S/. 2,972.00",25/02/2025,10/03/2025,74015e69-c883-48db-a7ef-86a639ea4b8b,2025-02-26 02:31:58.265691
APOYO EN EL INVENTARIO DE EXPENDIENTES EN EL ARCHIVO CENTRAL-PLAN DE DESCARGA PROCESAL,PODER JUDICIAL,AREQUIPA - AREQUIPA,D.LEG 1057 - DETERMINADO (NECESIDAD TRANSITORIA)-004,1,"S/. 1,950.00",25/02/2025,10/03/2025,a56ce70c-a295-43b1-9e5f-2f5bbf8664ed,2025-02-26 02:31:58.265691
ESPECIALISTA JUDICIAL DE AUDIENCIA,PODER JUDICIAL,AREQUIPA - AREQUIPA,D.LEG 1057 - DETERMINADO (NECESIDAD TRANSITORIA)-004,1,"S/. 3,850.00",25/02/2025,10/03/2025,71d55025-1f9c-4a9e-9491-72f31fe50f55,2025-02-26 02:31:58.265691
ADMINISTRADOR I,PODER JUDICIAL,AREQUIPA - AREQUIPA,D.LEG 1057 - DETERMINADO (SUPLENCIA)-003,1,"S/. 6,010.00",25/02/2025,10/03/2025,5a0bf697-0fa0-4ace-b68c-0aa0d65a78d4,2025-02-26 02:31:58.265691
JEFE DE SECRETARIA GENERAL,MUNICIPALIDAD DISTRITAL DE PUYCA,AREQUIPA - PUYCA,D.LEG 1057 - DETERMINADO (NECESIDAD TRANSITORIA)-001,1,"S/. 2,500.00",24/02/2025,07/03/2025,48efc905-c784-41e5-bb70-8bce6c2426b5,2025-02-26 02:31:58.265691
"SUB GERENTE DE ABASTECIMIENTOS, SERVICIOS GENERALES E INFORMATICA.",MUNICIPALIDAD DISTRITAL DE PUYCA,AREQUIPA - PUYCA,D.LEG 1057 - DETERMINADO (NECESIDAD TRANSITORIA)-001,1,"S/. 2,500.00",24/02/2025,07/03/2025,4d644301-d787-4923-a5f5-fa4e6e969c9c,2025-02-26 02:31:58.265691
SUB GERENTE DE TESORERIA,MUNICIPALIDAD DISTRITAL DE PUYCA,AREQUIPA - PUYCA,D.LEG 1057 - DETERMINADO (NECESIDAD TRANSITORIA)-001,1,"S/. 3,000.00",24/02/2025,07/03/2025,9be4fe8b-95ca-4f65-a4ee-dbe8671b553a,2025-02-26 02:31:58.265691
ESPECIALISTA EN FINANZAS - PRESUPUESTO,MUNICIPALIDAD PROVINCIAL DE CAYLLOMA,AREQUIPA - CHIVAY,D.LEG 1057 - DETERMINADO (NECESIDAD TRANSITORIA)-02,1,"S/. 2,000.00",24/02/2025,07/03/2025,6b810f2c-ff3e-4879-b37f-24c187942c3f,2025-02-26 02:31:58.265691
OPERADOR/A DE MONITOREO,"SUPERINTENDENCIA DE TRANSPORTE TERRESTRE DE PERSONAS, CARGA Y MERCANCIAS - SUTRAN",AREQUIPA - AREQUIPA,D.LEG 1057 - DETERMINADO (NECESIDAD TRANSITORIA)-048,1,"S/. 2,000.00",24/02/2025,07/03/2025,fc88b85f-fb76-4747-ba40-6abd1e0ba61e,2025-02-26 02:31:58.265691
ESPECIALISTA EN RELACIONES PUBLICAS,MUNICIPALIDAD PROVINCIAL DE CAYLLOMA,AREQUIPA - CHIVAY,D.LEG 1057 - DETERMINADO (NECESIDAD TRANSITORIA)-02,1,"S/. 2,000.00",24/02/2025,07/03/2025,7fc6578a-c2e2-4235-a78a-256d88f39561,2025-02-26 02:31:58.265691
TÉCNICO ADMINISTRATIVO,FUERZA AEREA DEL PERU,AREQUIPA - LA JOYA,276-04,1,"S/. 3,072.30",24/02/2025,07/03/2025,01ecf660-ad6f-4a6b-bcca-adea8328728f,2025-02-26 02:31:58.265691
OPERADOR(A) DE VEHÍCULOS MOTORIZADOS,FUERZA AEREA DEL PERU,AREQUIPA - CERRO COLORADO,276-01,1,"S/. 3,072.30",24/02/2025,07/03/2025,5d2d5125-10c8-4231-b5be-011d8d1eabdb,2025-02-26 02:31:58.265691
TRABAJADOR(A) SOCIAL,FUERZA AEREA DEL PERU,AREQUIPA - CERRO COLORADO,276-1,1,"S/. 5,309.50",24/02/2025,07/03/2025,8d14798f-996e-42d0-9466-4cf376bee9b9,2025-02-26 02:31:58.265691
ESPECIALISTA EN PROMOCION CULTURAL,MUNICIPALIDAD PROVINCIAL DE CAYLLOMA,AREQUIPA - CHIVAY,D.LEG 1057 - DETERMINADO (NECESIDAD TRANSITORIA)-02,1,"S/. 2,000.00",24/02/2025,07/03/2025,f57f7e90-b969-47be-8267-7c0b55c947d1,2025-02-26 02:31:58.265691
FISCALIZADOR-GERENCIA AGENCIA MAJES,MUNICIPALIDAD PROVINCIAL DE CAYLLOMA,AREQUIPA - MAJES,D.LEG 1057 - DETERMINADO (NECESIDAD TRANSITORIA)-002,1,"S/. 1,500.00",21/02/2025,06/03/2025,43e8475e-1cf3-413d-b8fd-25b361f7c5cc,2025-02-26 02:31:58.265691
MONITOR DE GESTIÓN LOCAL,PROGRAMA NACIONAL DE ALIMENTACIÓN ESCOLAR QALI WARMA,AREQUIPA - SAN ANTONIO DE CHUCA,D.LEG 1057 - DETERMINADO (SUPLENCIA)-002,1,"S/. 2,500.00",21/02/2025,06/03/2025,febfc1e9-b043-4a76-92d2-7d02582f3a4a,2025-02-26 02:31:58.265691
RESPONSABLE DE PAPELETAS,MUNICIPALIDAD PROVINCIAL DE CAYLLOMA,AREQUIPA - MAJES,D.LEG 1057 - DETERMINADO (NECESIDAD TRANSITORIA)-002,1,"S/. 1,600.00",21/02/2025,06/03/2025,80a8b433-76b9-4200-8ca9-a3c25f65c26a,2025-02-26 02:31:58.265691
JEFE DE LA OFICINA DE LOGISTICA,MUNICIPALIDAD DISTRITAL DE TUTI,AREQUIPA - TUTI,D.LEG 1057 - DETERMINADO (NECESIDAD TRANSITORIA)-001,1,"S/. 2,000.00",21/02/2025,06/03/2025,af19e450-4c86-4985-84fb-dc4144082eb3,2025-02-26 02:31:58.265691
JEFE DE LA OFICINA DE TESORERIA,MUNICIPALIDAD DISTRITAL DE TUTI,AREQUIPA - TUTI,D.LEG 1057 - DETERMINADO (NECESIDAD TRANSITORIA)-001,1,"S/. 1,600.00",21/02/2025,06/03/2025,5955f267-32ad-4ace-a642-b552e8377c1e,2025-02-26 02:31:58.265691
ABOGADO PARA LA GERENCIA MUNICIPAL,MUNICIPALIDAD PROVINCIAL DE CAYLLOMA,AREQUIPA - CHIVAY,D.LEG 1057 - DETERMINADO (NECESIDAD TRANSITORIA)-002,1,"S/. 2,000.00",21/02/2025,06/03/2025,b0b4b7ed-ce3c-42ed-b2c9-a63aa72b78e4,2025-02-26 02:31:58.265691
ADMINISTRADOR DE U.E. GENERACIÓN ELÉCTRICA,MUNICIPALIDAD PROVINCIAL DE CAYLLOMA,AREQUIPA - CHIVAY,D.LEG 1057 - DETERMINADO (NECESIDAD TRANSITORIA)-002,1,"S/. 1,800.00",21/02/2025,06/03/2025,22545c3a-ce34-4a16-bf62-98421d2cb9dd,2025-02-26 02:31:58.265691
ASISTENTE ADMINISTRATIVO DEL PAD,MUNICIPALIDAD PROVINCIAL DE CAYLLOMA,AREQUIPA - CHIVAY,D.LEG 1057 - DETERMINADO (NECESIDAD TRANSITORIA)-002,1,"S/. 1,600.00",21/02/2025,06/03/2025,b26f50f8-6726-4b42-9c65-6d7f891e46ea,2025-02-26 02:31:58.265691
ASISTENTE ADMINISTRATIVO PARA LA SUB GERENCIA DE SEGURIDAD PÚBLICA Y DEFENSA NACIONAL,MUNICIPALIDAD PROVINCIAL DE CAYLLOMA,AREQUIPA - CHIVAY,D.LEG 1057 - DETERMINADO (NECESIDAD TRANSITORIA)-002,1,"S/. 1,600.00",21/02/2025,06/03/2025,d3a9398b-d59b-4caa-941e-ba9c373bd700,2025-02-26 02:31:58.265691
ASISTENTE ADMINISTRATIVO- GERENCIA DE DESARROLLO URBANO Y RURAL,MUNICIPALIDAD PROVINCIAL DE CAYLLOMA,AREQUIPA - CHIVAY,D.LEG 1057 - DETERMINADO (NECESIDAD TRANSITORIA)-002,1,"S/. 1,600.00",21/02/2025,06/03/2025,4f73d0a7-015e-410b-adcf-d8aa442cf6f8,2025-02-26 02:31:58.265691
ASISTENTE TÉCNICO ADMINISTRATIVO DE TESORERÍA,MUNICIPALIDAD PROVINCIAL DE CAYLLOMA,AREQUIPA - CHIVAY,D.LEG 1057 - DETERMINADO (NECESIDAD TRANSITORIA)-002,1,"S/. 1,800.00",21/02/2025,06/03/2025,4bf207c9-ec99-41c5-95b7-4f5d65d09f6e,2025-02-26 02:31:58.265691
ASISTENTE LEGAL - GAJ,MUNICIPALIDAD PROVINCIAL DE CAYLLOMA,AREQUIPA - CHIVAY,D.LEG 1057 - DETERMINADO (NECESIDAD TRANSITORIA)-002,1,"S/. 2,000.00",21/02/2025,06/03/2025,58ddf6e2-2afd-42ba-8e6c-b088b69e32cd,2025-02-26 02:31:58.265691
BRIGADISTA-SGDCDN,MUNICIPALIDAD PROVINCIAL DE CAYLLOMA,AREQUIPA - CHIVAY,D.LEG 1057 - DETERMINADO (NECESIDAD TRANSITORIA)-002,1,"S/. 1,500.00",21/02/2025,06/03/2025,42deb98c-dbf5-4152-91b5-2f32a4e00c90,2025-02-26 02:31:58.265691
CONDUCTOR DE CAMIÓN VOLQUETE,MUNICIPALIDAD PROVINCIAL DE CAYLLOMA,AREQUIPA - CHIVAY,D.LEG 1057 - DETERMINADO (NECESIDAD TRANSITORIA)-002,1,"S/. 2,200.00",21/02/2025,06/03/2025,cfb99bad-47f5-4eeb-8cab-aec7ae1b3fa2,2025-02-26 02:31:58.265691
ESPECIALISTA DE SIGA,MUNICIPALIDAD PROVINCIAL DE CAYLLOMA,AREQUIPA - CHIVAY,D.LEG 1057 - DETERMINADO (NECESIDAD TRANSITORIA)-002,1,"S/. 2,000.00",21/02/2025,06/03/2025,af310bff-9cdd-4240-98e1-ec91d98a6fc4,2025-02-26 02:31:58.265691
INSPECTOR-SGTCV,MUNICIPALIDAD PROVINCIAL DE CAYLLOMA,AREQUIPA - CHIVAY,D.LEG 1057 - DETERMINADO (NECESIDAD TRANSITORIA)-002,1,"S/. 1,500.00",21/02/2025,06/03/2025,7cf71949-4974-46bc-9fbf-8821c0ea5b58,2025-02-26 02:31:58.265691
MESA DE PARTES - SGL,MUNICIPALIDAD PROVINCIAL DE CAYLLOMA,AREQUIPA - CHIVAY,D.LEG 1057 - DETERMINADO (NECESIDAD TRANSITORIA)-002,1,"S/. 1,500.00",21/02/2025,06/03/2025,00d7ac31-e56c-4c12-b462-d6aae9c0623a,2025-02-26 02:31:58.265691
NOTIFICADOR DE LA SGTCV,MUNICIPALIDAD PROVINCIAL DE CAYLLOMA,AREQUIPA - CHIVAY,D.LEG 1057 - DETERMINADO (NECESIDAD TRANSITORIA)-002,1,"S/. 1,500.00",21/02/2025,06/03/2025,082e4da6-b5f2-4794-81cc-932fdf4bb46b,2025-02-26 02:31:58.265691
OPERADOR MAQUINARIA PESADA-CARGADOR FRONTAL,MUNICIPALIDAD PROVINCIAL DE CAYLLOMA,AREQUIPA - CHIVAY,D.LEG 1057 - DETERMINADO (NECESIDAD TRANSITORIA)-002,1,"S/. 2,200.00",21/02/2025,06/03/2025,6fd52d99-948c-4ace-853c-369de84628ca,2025-02-26 02:31:58.265691
PROFESIONAL PARA LA INVERSIÓN TÉCNICA-NIVEL DE PRE INVERSIÓN DE LOS PROYECTOS DE INVERSIÓN,MUNICIPALIDAD PROVINCIAL DE CAYLLOMA,AREQUIPA - CHIVAY,D.LEG 1057 - DETERMINADO (NECESIDAD TRANSITORIA)-002,1,"S/. 2,800.00",21/02/2025,06/03/2025,70aa5890-c8bb-4d35-9b12-98b771c53223,2025-02-26 02:31:58.265691
RESPONSABLE DE JUVENTUDES-SGEDYJ,MUNICIPALIDAD PROVINCIAL DE CAYLLOMA,AREQUIPA - CHIVAY,D.LEG 1057 - DETERMINADO (NECESIDAD TRANSITORIA)-002,1,"S/. 1,800.00",21/02/2025,06/03/2025,cb51d2e3-97d4-4e50-8fe8-686e24c28a1c,2025-02-26 02:31:58.265691
RESPONSABLE DE ORDENES DE SERVICIO Y DE COMPRA,MUNICIPALIDAD PROVINCIAL DE CAYLLOMA,AREQUIPA - CHIVAY,D.LEG 1057 - DETERMINADO (NECESIDAD TRANSITORIA)-002,1,"S/. 1,800.00",21/02/2025,06/03/2025,0b9f25a4-cb8f-4c42-a168-c4318d54ceb1,2025-02-26 02:31:58.265691
AUXILIAR JUDICIAL-PROTECCION,PODER JUDICIAL,ANCASH - INDEPENDENCIA,D.LEG 1057 - DETERMINADO (NECESIDAD TRANSITORIA)-15,1,"S/. 2,900.00",25/02/2025,10/03/2025,bf5308f7-c091-4d05-bf0e-1a5af6dd1965,2025-02-26 02:31:58.265691
"COORDINADOR DE LA UNIDAD DE ULE, PN, PVL",MUNICIPALIDAD DISTRITAL DE INDEPENDENCIA,ANCASH - INDEPENDENCIA,D.LEG 1057 - DETERMINADO (NECESIDAD TRANSITORIA)-1,1,"S/. 3,000.00",24/02/2025,07/03/2025,8d86e346-0b9e-41b5-8d09-f68e0f58db7e,2025-02-26 02:31:58.265691
COORDINADOR DE LA UNIDAD DE PROMOCION EMPRESARIAL,MUNICIPALIDAD DISTRITAL DE INDEPENDENCIA,ANCASH - INDEPENDENCIA,D.LEG 1057 - DETERMINADO (NECESIDAD TRANSITORIA)-001,1,"S/. 3,000.00",24/02/2025,07/03/2025,64b4fbb9-793a-44f6-a6e0-90ea9f86f7ba,2025-02-26 02:31:58.265691
ESPECIALISTA CONTABLE,MUNICIPALIDAD DISTRITAL DE INDEPENDENCIA,ANCASH - INDEPENDENCIA,D.LEG 1057 - DETERMINADO (NECESIDAD TRANSITORIA)-1,1,"S/. 3,000.00",24/02/2025,07/03/2025,5e4a6250-c0fd-469a-9154-392609e0298b,2025-02-26 02:31:58.265691
ESPECIALISTA LEGAL,MUNICIPALIDAD DISTRITAL DE INDEPENDENCIA,ANCASH - INDEPENDENCIA,D.LEG 1057 - DETERMINADO (NECESIDAD TRANSITORIA)-1,1,"S/. 2,500.00",24/02/2025,07/03/2025,5230b623-d9b4-485d-83df-f0cadd614942,2025-02-26 02:31:58.265691
